UID,supporters,url,local_names,slug,name,parent,acronym,involvement,description,country.name,country.slug,country
women-agaist-the-expansion-of-eucalyptus-monoculture,,https://www.bndes.gov.br/wps/portal/site/home,,bndes,Banco Nacional de Desenvolvimento Econômico e Social,,BNDES,,"Banco Nacional de Desarrollo, Brasil",Brazil,brazil,
barro-blanco-dam-panama,,http://www.aida-americas.org/,,interamerican-association-for-environmental-defense,Interamerican Association for Environmental Defense,,AIDA,,,,,
barro-blanco-dam-panama,,https://www.fmo.nl/,,netherlands-development-finance-company,Netherlands Development Finance Company,,FMO,Finance,,Netherlands,netherlands,
barro-blanco-dam-panama,,https://www.deginvest.de/International-financing/DEG/,,german-investment-corporation,German Investment Corporation,,DEG,Finance,,Germany,germany,
barro-blanco-dam-panama,,http://www.bcie.org/?lang=en,,central-american-bank-for-economic-integration,Central American Bank for Economic Integration,,BCIE,,,,,
barro-blanco-dam-panama,,www.un.org,,united-nations-human-rights-council,United Nations Human Rights Council,,UN,,,United States of America ,united-states-of-america,
san-mateo-ixtatan,,"http://bidcomunidades.iadb.org/es/banco-interamericano-de-desarrollo,2837.html",,banco-interamericano-de-desarrollo-bid,Banco Interamericano de Desarrollo (BID) ,,BID ,,"El Banco Interamericano de Desarrollo (BID) es una organización financiera internacional con sede en la ciudad de Washington D.C. (Estados Unidos), y creada en el año de 1959 con el propósito de financiar proyectos viables de desarrollo económico, social e institucional y promover la integración comercial regional en el área de América Latina y el Caribe.",United States of America ,united-states-of-america,
san-mateo-ixtatan,,http://www.bcie.org/?lang=es,,banco-centroamericano-de-integracion-economica,Banco Centroamericano de Integración Económica  ,,BCIE,,,,,
san-mateo-ixtatan,,"http://www.iadb.org/en/about-us/about-the-inter-americahttp://www.iadb.org/en/inter-american-development-bank,2837.htmln-development-bank,5995.html",,inter-american-development-bank,Inter-American Development Bank,,IADB,,,,,
west-african-gas-pipeline,,www.worldbank.org,,world-bank,The World Bank,,WB,,,United States of America ,united-states-of-america,
highway-threatens-old-oak-tree-savinac-serbia,,http://english.eximbank.gov.cn/en/,,china-export-import-bank,China Export Import Bank,,China Exim,Supports construction of Corridor XI with 301 million USD loan,,China,china,
ec-leuser,,,,40,,,,,The World Bank,,,
lgv-bretagne,,,,french-government,French government,,,,,France,france,
lgv-bretagne,,,,territorial-governments,Territorial governments,,,,,,,
lgv-bretagne,,,,rff-reseau-ferre-de-france,RFF (réseau ferré de France) ,,,,,,,
rampur-hydroelectric-project-india,,www.worldbank.org,,world-bank,The World Bank,,WB,,,United States of America ,united-states-of-america,
rampur-hydroelectric-project-india,,"http://web.worldbank.org/WBSITE/EXTERNAL/EXTABOUTUS/EXTIBRD/0,,menuPK:3046081~pagePK:64168427~piPK:64168435~theSitePK:3046012,00.html",,international-bank-for-reconstruction-and-development,International Bank For Reconstruction And Development,,IBRD,,,,,
rampur-hydroelectric-project-india,,,,clean-development-mechanism-executive-board,Clean Development Mechanism Executive Board,,CDM Executive Board,,,,,
gazoduq-natural-gas-pipeline-quebec-canada,,https://breyercapital.com/,,breyer-capital, Breyer Capital,,,Invested in GNL's project,,,,
gazoduq-natural-gas-pipeline-quebec-canada,,http://www.freestoneinternational.com/,,freestone-international,Freestone International,,,Invested in GNL's project,,,,
danish-polish-baltic-pipe-fossil-gas-infrastructure-project-denmark,,https://ec.europa.eu/inea/en/connecting-europe-facility,,european-commission-connecting-europe-facility,European Commission (Connecting Europe Facility) ,,CEF,Project funding,"EU funding instrument to promote growth, jobs and competitiveness through targeted infrastructure investment at European level (from European Commission website).",,,
indigenas-de-calakmul-contra-el-tren-maya,,,,fideicomiso-de-inversion-y-bienes-raices-fibra-tren-maya,Fideicomiso de Inversión y Bienes Raíces (Fibra Tren Maya),,,"Mecanismo financiero para el desarrollo de los polos de ""desarrollo""",,Mexico,mexico,
dung-quat-economic-zone-authority-deza-vietnam,,https://www.vietcombank.com.vn/,,vietcombank,Vietcombank,,,,,Vietnam,vietnam,
dung-quat-economic-zone-authority-deza-vietnam,,http://www.bnpparibas.com/,,bnp-paribas,BNP Paribas,,BNP,,,France,france,
dung-quat-economic-zone-authority-deza-vietnam,,www.mizuhobank.com,,mizuho-corporate-bank,Mizuho Bank,,MFG,,Integrated retail and corporate banking unit of Mizuho Financial Group. One of three Japanese megabanks.,Japan,japan,
dung-quat-economic-zone-authority-deza-vietnam,,https://cms.mx.bk.mufg.jp/,,the-bank-of-tokyo-mitsubishi,The Bank of Tokyo Mitsubishi UFJ ,,MUFG Bank,,,Japan,japan,
dung-quat-economic-zone-authority-deza-vietnam,,http://nexi.go.jp/en/,,nippon-export-and-investment-insurance-nexi,Nippon Export and Investment Insurance (NEXI),,NEXI,"insurance, credit",,Japan,japan,
mega-proyecto-hidroelectrico-el-diquis-costa-rica,,,,banco-interamericano-de-desarrollo,Banco Centroamericano de Inversión e Infraestructura ,,BCIE ,préstamo,,,,
uranio-samana-caldas-colombia,,,,australian-nuclear-science-and-technology-organisation,Australian Nuclear Science and Technology Organisation,,ANSTO,,,Australia,australia,
taganito-mining-corporations-nickel-mine-surigao-del-nortephilippines,,http://www.jbic.go.jp/en,,japan-bank-for-international-cooperation,Japan Bank for International Corporation,,JBIC,,,Japan,japan,
pande-and-temene-gas-field-mozambique,,https://cdm.unfccc.int/about/index.html,,united-nations-framework-convention-on-climate-change,United Nations Framework Convention on Climate Change/CDM,,UNFCC,,"With 196 Parties, the United Nations Framework Convention on Climate Change (UNFCCC) has near universal membership and is the parent treaty of the 1997 Kyoto Protocol. The Kyoto Protocol has been ratified by 192 of the UNFCCC Parties. 
            The ultimate objective of both treaties is to stabilize greenhouse gas concentrations in the atmosphere at a level that will prevent dangerous human interference with the climate system.
            The CDM allows emission-reduction projects in developing countries to earn certified emission reduction (CER) credits, each equivalent to one tonne of CO2. These CERs can be traded and sold, and used by industrialized countries to a meet a part of their emission reduction targets under the Kyoto Protocol.
            The mechanism stimulates sustainable development and emission reductions, while giving industrialized countries some flexibility in how they meet their emission reduction limitation targets.
            The CDM is the main source of income for the UNFCCC Adaptation Fund, which was established to finance adaptation projects and programmes in developing country Parties to the Kyoto Protocol that are particularly vulnerable to the adverse effects of climate change. The Adaptation Fund is financed by a 2% levy on CERs issued by the CDM.",,,
bumbuna-dam-sierra-leone,,www.worldbank.org,,world-bank,The World Bank,,WB,,,United States of America ,united-states-of-america,
bumbuna-dam-sierra-leone,,,,african-development-bank11,African Development Bank - Banque Africaine de Développement,,,,,,,
sappi-saiccor-pulp-mill-pollution-south-africa,,https://fsc.org/en,,forest-stewardship-council,Forest Stewardship Council,,FSC,,,,,
hotel-de-grupo-posadas-destruye-santuarios-de-tortugas-marinas-en-bahia-chemuyil-mexico,,https://www.actinver.com/web/actinver/,,banco-actinver-sa-ibm,"Banco Actinver, S.A. I.B.M",,,Fiduciaria del proyecto,,Mexico,mexico,
gullu-hydroelectric-project-chhattisgarh-india,,https://cdm.unfccc.int/about/index.html,,united-nations-framework-convention-on-climate-change,United Nations Framework Convention on Climate Change/CDM,,UNFCC,Financing ,"With 196 Parties, the United Nations Framework Convention on Climate Change (UNFCCC) has near universal membership and is the parent treaty of the 1997 Kyoto Protocol. The Kyoto Protocol has been ratified by 192 of the UNFCCC Parties. 
            The ultimate objective of both treaties is to stabilize greenhouse gas concentrations in the atmosphere at a level that will prevent dangerous human interference with the climate system.
            The CDM allows emission-reduction projects in developing countries to earn certified emission reduction (CER) credits, each equivalent to one tonne of CO2. These CERs can be traded and sold, and used by industrialized countries to a meet a part of their emission reduction targets under the Kyoto Protocol.
            The mechanism stimulates sustainable development and emission reductions, while giving industrialized countries some flexibility in how they meet their emission reduction limitation targets.
            The CDM is the main source of income for the UNFCCC Adaptation Fund, which was established to finance adaptation projects and programmes in developing country Parties to the Kyoto Protocol that are particularly vulnerable to the adverse effects of climate change. The Adaptation Fund is financed by a 2% levy on CERs issued by the CDM.",,,
chixoy-dam-guatemala,,www.worldbank.org,,world-bank,The World Bank,,WB,,,United States of America ,united-states-of-america,
chixoy-dam-guatemala,,"http://www.iadb.org/en/about-us/about-the-inter-americahttp://www.iadb.org/en/inter-american-development-bank,2837.htmln-development-bank,5995.html",,inter-american-development-bank,Inter-American Development Bank,,IADB,,,,,
leeds-bradford-airport-expansion-plans-uk,,,,amp-capital,AMP Capital,,,,,,,
pfoa-contamination-in-bennington-vermont,,https://www.plastics.saint-gobain.com/,,saint-gobain-performance-plastics,Saint-Gobain Performance Plastics,,,"In 2002, Saint-Gobain bought ChemFab and is therefore largely responsible for the hazardous chemicals released into drinking water",Saint-Gobain Performance Plastics is a producer of polymer products to support various industries world-wide,United States of America ,united-states-of-america,
uranium-mining-in-caetite-brazil,,,,international-atomic-energy-agency,International Atomic Energy Agency,,IAEA,,,,,
tanjung-awar-awar-coal-fired-power-plant-indonesia,,http://www.boc.cn/en/,,bank-of-china,Bank of China,,BOC,,The Bank of China (BOC; Chinese: 中国银行) is a Chinese national commercial bank headquartered in Beijing and the fourth largest bank in the world.,China,china,
tanjung-awar-awar-coal-fired-power-plant-indonesia,,https://www.sinosure.com.cn/en/,,china-export-credit-insurance-corporation,China Export & Credit Insurance Corporation,,Sinosure,,"China Export & Credit Insurance Corporation (Sinosure) is a major Chinese state owned enterprise under the administration of MFPRC serving as the provider of export credit insurance, in particular coverage for the export of high-value added goods in China.",China,china,
tanjung-awar-awar-coal-fired-power-plant-indonesia,,https://www.bni.co.id/id-id/,,bank-negara-indonesia,Bank Negara Indonesia,,BNI,,State-owned Indonesian bank,Indonesia,indonesia,
tanjung-awar-awar-coal-fired-power-plant-indonesia,,https://ir-bri.com/,,bank-rakyat-indonesia,Bank Rakyat Indonesia,,,,One of Indonesia's largest banks,Indonesia,indonesia,
conservation-areas-near-the-coal-plant-in-east-java,,,,export-import-bank-of-china,Export-Import Bank of China,,,,,China,china,
water-and-sewerage-anti-privatization-movement-in-thessaloniki,,,,european-central-bank,European Central Bank,,ECB,,,,,
water-and-sewerage-anti-privatization-movement-in-thessaloniki,,  http://www.imf.org/external/index.htm,,fondo-monetario-internacional,International Monetary Fund,,FMI,,"El Fondo Monetario Internacional o FMI (en inglés: International Monetary Fund) es una institución internacional que en la actualidad reúne a 188 países, y cuyo papel, según sus estatutos, es «fomentar la cooperación monetaria internacional; facilitar la expansión y el crecimiento equilibrado del comercio internacional; fomentar la estabilidad cambiaria; contribuir a establecer un sistema multilateral de pagos para las transacciones corrientes entre los países miembros y eliminar las restricciones cambiarias que dificulten la expansión del comercio mundial; infundir confianza a los países miembros poniendo a su disposición temporalmente y con las garantías adecuadas los recursos del Fondo, dándoles así oportunidad de que corrijan los desequilibrios de sus balanzas de pagos sin recurrir a medidas perniciosas para la prosperidad nacional o internacional, para acortar la duración y aminorar el desequilibrio de sus balanzas de pagos».1 Su sede se encuentra en Washington, la capital de Estados Unidos",,,
lex-izera,,,,reprivatisation-fund-poland,Reprivatisation Fund (Poland),,,"60,000,000 for Izera car factory as a contribution of the State Treasury",Polish special purpose public fund for the payment of compensation resulting from judgments and court settlements as well as administrative decisions issued in connection with unlawful nationalization of property. The main and only planned source of income are the proceeds from the sale of 5% of shares owned by the State Treasury in each of the companies established as a result of commercialization and interest on these funds.,Poland,poland,
offshore-oil-bonanza-poses-existential-threat-for-coastal-communities-suriname,,  http://www.imf.org/external/index.htm,,fondo-monetario-internacional,International Monetary Fund,,FMI,,"El Fondo Monetario Internacional o FMI (en inglés: International Monetary Fund) es una institución internacional que en la actualidad reúne a 188 países, y cuyo papel, según sus estatutos, es «fomentar la cooperación monetaria internacional; facilitar la expansión y el crecimiento equilibrado del comercio internacional; fomentar la estabilidad cambiaria; contribuir a establecer un sistema multilateral de pagos para las transacciones corrientes entre los países miembros y eliminar las restricciones cambiarias que dificulten la expansión del comercio mundial; infundir confianza a los países miembros poniendo a su disposición temporalmente y con las garantías adecuadas los recursos del Fondo, dándoles así oportunidad de que corrijan los desequilibrios de sus balanzas de pagos sin recurrir a medidas perniciosas para la prosperidad nacional o internacional, para acortar la duración y aminorar el desequilibrio de sus balanzas de pagos».1 Su sede se encuentra en Washington, la capital de Estados Unidos",,,
offshore-oil-bonanza-poses-existential-threat-for-coastal-communities-suriname,,https://www.worldbank.org/en/home,,world-bank100,World Bank,,WB,,"The Asia Sustainable and Alternative Energy Program (ASTAE), which is a trust fund program, financed a grant for the World Bank team in preparing the groundwork to develop its own lending to the Pavagada Solar Park and a similar project elsewhere in India. ASTAE support has been crucial in allowing the Bank to develop templates for required financial management and procurement actions, as well as the environmental and social screening actions that all solar parks will have to follow if they wish to be sustainable and well managed. It has also helped the World Bank communicate international best practices to the Indian team gearing to implement the solar park.",,,
offshore-oil-bonanza-poses-existential-threat-for-coastal-communities-suriname,,"http://www.iadb.org/en/about-us/about-the-inter-americahttp://www.iadb.org/en/inter-american-development-bank,2837.htmln-development-bank,5995.html",,inter-american-development-bank,Inter-American Development Bank,,IADB,,,,,
tokwe-mukorsi-dam-zimbabwe,,,,development-bank-of-zimbabwe,Development Bank of Zimbabwe,,,,,Zimbabwe,zimbabwe,
moserbaer-thermal-power-plant-at-anuppur-madhya-pradesh-india,,http://www.macquarie.com/fr/corporate,,macquarie-sbi-infrastructure-fund,Macquarie group,,,,"Global investment and baking group, one of the major financial actor regarding infrastructures funds.",Australia,australia,
moserbaer-thermal-power-plant-at-anuppur-madhya-pradesh-india,,,,state-bank-of-india,State Bank of India,,,,,India,india,
moserbaer-thermal-power-plant-at-anuppur-madhya-pradesh-india,,http://www.bk.mufg.jp/global/,,bank-of-tokyo-mitsubishi-ufj,The Bank of Tokyo Mitsubishi UFJ,,MUFG,,"Largest bank in Japan, eighth largest in the world according to Bloomberg. Serves as the core retail, corporate, and investment banking arm of the Mitsubishi UFJ Financial Group.",Japan,japan,
panna-tiger-reserve-india,,https://www.wwf.org.mx/,,worldwide-fund-for-nature,World Wildlife Fund ,,WWF,,"Alianza WWF - Fundación TELMEX Telcel apoya la conservación y restauración de los bosques y la financiación de alternativas económicas para las comunidades. 
",Switzerland,switzerland,
geotube-construction-in-pentha-india,,www.worldbank.org,,world-bank,The World Bank,,WB,,,United States of America ,united-states-of-america,
upm-ex-botnia-uruguay,,www.worldbank.org,,world-bank,The World Bank,,WB,,,United States of America ,united-states-of-america,
upm-ex-botnia-uruguay,,http://www.fao.org,,food-and-agricultural-organisation,Food and Agricultural Organisation,,FAO,,,,,
upm-ex-botnia-uruguay,,https://www.jica.go.jp/english/,,japan-international-cooperation-agency,Japan International Cooperation Agency,,JICA,,"Established as an Incorporated Administrative Agency under the Act of the Incorporated Administrative Agency - Japan International Cooperation Agency (Act No. 136, 2002), JICA aims to contribute to the promotion of international cooperation as well as the sound development of Japanese and global economy by supporting the socioeconomic development, recovery or economic stability of developing regions.",Japan,japan,
upm-ex-botnia-uruguay,,"http://www.iadb.org/en/about-us/about-the-inter-americahttp://www.iadb.org/en/inter-american-development-bank,2837.htmln-development-bank,5995.html",,inter-american-development-bank,Inter-American Development Bank,,IADB,,,,,
kwale-okpai-cdm-project-nigeria,,https://cdm.unfccc.int/about/index.html,,united-nations-framework-convention-on-climate-change,United Nations Framework Convention on Climate Change/CDM,,UNFCC,,"With 196 Parties, the United Nations Framework Convention on Climate Change (UNFCCC) has near universal membership and is the parent treaty of the 1997 Kyoto Protocol. The Kyoto Protocol has been ratified by 192 of the UNFCCC Parties. 
            The ultimate objective of both treaties is to stabilize greenhouse gas concentrations in the atmosphere at a level that will prevent dangerous human interference with the climate system.
            The CDM allows emission-reduction projects in developing countries to earn certified emission reduction (CER) credits, each equivalent to one tonne of CO2. These CERs can be traded and sold, and used by industrialized countries to a meet a part of their emission reduction targets under the Kyoto Protocol.
            The mechanism stimulates sustainable development and emission reductions, while giving industrialized countries some flexibility in how they meet their emission reduction limitation targets.
            The CDM is the main source of income for the UNFCCC Adaptation Fund, which was established to finance adaptation projects and programmes in developing country Parties to the Kyoto Protocol that are particularly vulnerable to the adverse effects of climate change. The Adaptation Fund is financed by a 2% levy on CERs issued by the CDM.",,,
sumsel-8-coal-fired-power-plant-south-sumatra-indonesia,,http://english.eximbank.gov.cn/en/,,the-export-import-bank-of-china,Export-Import Bank of China,,EXIM Bank of China,Agreed to provide a USD 1.26 billion loan facility to HBAP for the construction of the Sumsel-8 power project in May 2018,"Founded in 1994, the Export-Import Bank of China is a state bank solely owned by the Chinese government and under the direct leadership of the State Council.",China,china,
the-aral-sea-dried-due-to,,www.worldbank.org,,world-bank,The World Bank,,WB,,,United States of America ,united-states-of-america,
the-aral-sea-dried-due-to,,http://www.unep.org,,united-nations-environmental-programme,United Nations Environmental Programme,,UNEP,,,,,
the-aral-sea-dried-due-to,,https://www.jica.go.jp/english/,,japan-international-cooperation-agency,Japan International Cooperation Agency,,JICA,,"Established as an Incorporated Administrative Agency under the Act of the Incorporated Administrative Agency - Japan International Cooperation Agency (Act No. 136, 2002), JICA aims to contribute to the promotion of international cooperation as well as the sound development of Japanese and global economy by supporting the socioeconomic development, recovery or economic stability of developing regions.",Japan,japan,
waste-dumping-amin-bazar,,https://www.jica.go.jp/english/,,japan-international-cooperation-agency,Japan International Cooperation Agency,,JICA,,"Established as an Incorporated Administrative Agency under the Act of the Incorporated Administrative Agency - Japan International Cooperation Agency (Act No. 136, 2002), JICA aims to contribute to the promotion of international cooperation as well as the sound development of Japanese and global economy by supporting the socioeconomic development, recovery or economic stability of developing regions.",Japan,japan,
illegal-unreported-and-unregulated-iuu-fishing-in-sherbro-river-sierra-leone,,,,world-bank-west-african-regional-fisheries-program,World Bank West African Regional Fisheries Program,,WARFP,,,,,
lower-omo-valley-irrigated-agriculture-development-ethiopia,,www.worldbank.org,,world-bank,The World Bank,,WB,,,United States of America ,united-states-of-america,
chiawelo-soweto-electricity-struggles-south-africa,,www.worldbank.org,,world-bank,The World Bank,,WB,,,United States of America ,united-states-of-america,
reddconflict-in-jambi-indonesia,,http://www.rspb.org.uk/,,royal-society-for-the-protection-of-birds-rsbpp,Royal Society for the Protection of Birds (RSBP),,RSBP,conservation,,United Kingdom,united-kingdom,
bisasar-rd-landfill-site-south-africa,,www.worldbank.org,,world-bank,The World Bank,,WB,,,United States of America ,united-states-of-america,
bisasar-rd-landfill-site-south-africa,,,,french-development-agency,French Development Agency,,AFD,,,France,france,
hybrid-rice-in-the-office-du-niger-mali,,www.worldbank.org,,world-bank,The World Bank,,WB,,,United States of America ,united-states-of-america,
hybrid-rice-in-the-office-du-niger-mali,,https://www.miga.org,,multilateral-investment-guarantee-agency,Multilateral Investment Guarantee Agency,,MIGA,,the World the Bank’s political risk insurer,,,
sugarcane-cultivation-and-oil-palm-plantation-in-polochic-valley-guatemala,,,,oficina-del-alto-comisionado-de-las-naciones-unidas-para-los-derechos-humanos-oacnudh,Oficina del Alto Comisionado de las Naciones Unidas para los Derechos Humanos (OACNUDH),,,,,,,
sugarcane-cultivation-and-oil-palm-plantation-in-polochic-valley-guatemala,,http://www.corteidh.or.cr/,,comision-interamericana-de-derechos-humanos-cidh,Inter-American Court of Human Rights,,CIDH,,,,,
boeung-kak-lake-evictions-phnom-penh,,www.worldbank.org,,world-bank,The World Bank,,WB,,,United States of America ,united-states-of-america,
upper-yeywa-dam-on-the-namtu-river-shan-state-myanmar,,http://www.eximbank.gov.cn/,,china-exim-bank,China Export Import Bank,,Chexim,,"Chinese institution that provides financial support to promote the export of Chinese products and services mainly in the infrastructure fields (roads, power plants, oil and gas pipelines, telecom, and water projects).",China,china,
apeco-special-economic-zone-on-ancestral-lands-and-fishing-grounds-aurora-island-philippines,,http://www.neda.gov.ph/,,the-national-economic-and-development-authority-neda,The National Economic and Development Authority (NEDA),,NEDA,economic development,NEDA is the governmental National Economic Development Authority of the Reupblic of the Philippines.,Philippines,philippines,
chinchaycocha-junin-peru,,,,2,Interamerican Court of Human Rights,,IACHR,,,,,
dirty-and-dangerous-shipbreaking-in-chittagong,,https://www.imo.org/en/,,international-maritime-organization,International Maritime Organization,,IMO,,"IMO is the UN Specialized Agency competent to regulate matters regarding the safety and security of navigation, the prevention of marine pollution",,,
dirty-and-dangerous-shipbreaking-in-chittagong,,https://www.ilo.org,,international-labour-organization,International Labour Organization,,ILO,,"The International Labour Organization (ILO) is devoted to promoting social justice and internationally recognized human and labour rights, pursuing its founding mission that social justice is essential to universal and lasting peace.
Only tripartite U.N. agency, the ILO brings together governments, employers and workers representatives of 187 member States , to set labour standards, develop policies and devise programmes promoting decent work for all women and men.
Today, the ILO's Decent Work agenda  helps advance the economic and working conditions that give all workers, employers and governments a stake in lasting peace, prosperity and progress.",Switzerland,switzerland,
dirty-and-dangerous-shipbreaking-in-chittagong,,www.worldbank.org,,world-bank,The World Bank,,WB,,,United States of America ,united-states-of-america,
dirty-and-dangerous-shipbreaking-in-chittagong,,http://www.unep.org/,,unep,United Nations Environment Programme,,UNEP,,,,,
water-disparities-in-texas-colonias-usa,,,,north-american-development-bank,North American Development Bank,,,,,,,
