UID,supporters,url,local_names,slug,name,parent,acronym,involvement,description,country.name,country.slug,country
millennium-challenge-account-irrigation-projects-mali,,"http://www.iadb.org/en/about-us/about-the-inter-americahttp://www.iadb.org/en/inter-american-development-bank,2837.htmln-development-bank,5995.html",,inter-american-development-bank,Inter-American Development Bank,,IADB,,,,,
trans-sibirskaya-hpp-russia,,,,export-import-bank-of-china,Export-Import Bank of China,,,,,China,china,
dams-in-guatemala-in-chajul-and-other-locations-guatemala,,"http://www.iadb.org/en/about-us/about-the-inter-americahttp://www.iadb.org/en/inter-american-development-bank,2837.htmln-development-bank,5995.html",,inter-american-development-bank,Inter-American Development Bank,,IADB,,,,,
intag-mining-junin-ecuador,,www.worldbank.org,,world-bank,The World Bank,,WB,,,United States of America ,united-states-of-america,
intag-mining-junin-ecuador,,https://www.jica.go.jp/english/,,japan-international-cooperation-agency,Japan International Cooperation Agency,,JICA,,"Established as an Incorporated Administrative Agency under the Act of the Incorporated Administrative Agency - Japan International Cooperation Agency (Act No. 136, 2002), JICA aims to contribute to the promotion of international cooperation as well as the sound development of Japanese and global economy by supporting the socioeconomic development, recovery or economic stability of developing regions.",Japan,japan,
cementos-progreso-san-juan-sacatepequez-guatemala,,,,comite-para-la-eliminacion-de-la-discriminacion-racial,Comite para la Eliminacion de la Discriminacion Racial,,,,,,,
cementos-progreso-san-juan-sacatepequez-guatemala,,,,observatorio-para-la-proteccion-de-los-defensores-de-derechos-humanos,Observatorio para la Proteccion de los Defensores de Derechos Humanos,,,,,,,
cementos-progreso-san-juan-sacatepequez-guatemala,,,,organizacion-mundial-contra-la-tortura,Organizacion Mundial Contra la Tortura,,,,,,,
cementos-progreso-san-juan-sacatepequez-guatemala,,,,federacion-internacional-de-derechos-humanos,Federacion Internacional de Derechos Humanos,,,,,,,
cementos-progreso-san-juan-sacatepequez-guatemala,,,,un-special-rapporteur-on-the-rights-of-indigenous-peoples,UN Special Rapporteur on the rights of indigenous peoples,,,,,,,
cementos-progreso-san-juan-sacatepequez-guatemala,,,,oficina-del-alto-comisionado-de-las-naciones-unidas-para-los-derechos-humanos-oacnudh,Oficina del Alto Comisionado de las Naciones Unidas para los Derechos Humanos (OACNUDH),,,,,,,
proyecto-hidroelectrico-rositas-bolivia,,http://www.eximbank.gov.cn/,,china-exim-bank,China Export Import Bank,,Chexim,,"Chinese institution that provides financial support to promote the export of Chinese products and services mainly in the infrastructure fields (roads, power plants, oil and gas pipelines, telecom, and water projects).",China,china,
pujada-nickel-mine-on-ancestral-lands-oriental-davao-philippines,,http://www.db.com/,,deutsche-bank,Deutsche Bank,,DB,"banking, finance",A large German banking and finance corporation.,Germany,germany,
pujada-nickel-mine-on-ancestral-lands-oriental-davao-philippines,,www.barclays.com,,barclays-bank,Barclays Bank,,,"banking, finance",,United Kingdom,united-kingdom,
pujada-nickel-mine-on-ancestral-lands-oriental-davao-philippines,,http://www.bnpparibas.com/,,bnp-paribas,BNP Paribas,,BNP,,,France,france,
pujada-nickel-mine-on-ancestral-lands-oriental-davao-philippines,,https://www.bankofamerica.com/,,bank-of-america,Bank of America,,BofA,"banking, finance",Multinational banking and financial services corporation headquartered in North Carolina. Second largest bank in the U.S. by assets. One of the Big Four Banks in the U.S.,United States of America ,united-states-of-america,
pujada-nickel-mine-on-ancestral-lands-oriental-davao-philippines,,www.jpmorganchase.com/,,jp-morgan-chase-co,JP Morgan Chase,,JPM,,"Largest bank in the United States, 6th largest bank in the world by total assets. One of the Big Four U.S. banks.",United States of America ,united-states-of-america,
pujada-nickel-mine-on-ancestral-lands-oriental-davao-philippines,,www.ubs.com,,ubs-switzerland,UBS Switzerland,,UBS,"banking, finance",A Swiss banking and finance corporation,Switzerland,switzerland,
pujada-nickel-mine-on-ancestral-lands-oriental-davao-philippines,,www.citigroup.com/,,citigroup-inc,Citigroup Inc.,,,"banking, finance",A major global banking and finance corporation,United States of America ,united-states-of-america,
pujada-nickel-mine-on-ancestral-lands-oriental-davao-philippines,,http://www.goldmansachs.com/,,goldman-sachs-group-inc,"Goldman Sachs Group, Inc.",,,"banking, finance",A global investment banking corporation.,United States of America ,united-states-of-america,
pujada-nickel-mine-on-ancestral-lands-oriental-davao-philippines,,https://www.commerzbank.com/en/hauptnavigation/konzern/commerzbank_im__berblick/commerzbank_ueberblick.html,,commerzbank,Commerzbank,,,,,Germany,germany,
pujada-nickel-mine-on-ancestral-lands-oriental-davao-philippines,,https://www.hsbc.co.uk/,,hsbc-united-kingdom,HSBC United Kingdom,,HSCB,,,United Kingdom,united-kingdom,
sugarcane-plantation-in-mabira-forest-reserve-uganda,,www.worldbank.org,,world-bank,The World Bank,,WB,,,United States of America ,united-states-of-america,
sugarcane-plantation-in-mabira-forest-reserve-uganda,,http://europa.eu/index_en.htm,,european-union,European Union,,EU,,Politico-economic union of 28 member states that are primarily located in Europe.,,,
serengeti-national-park-and-its-highway-tanzania,,,,federal-government-of-germany,Federal Government of Germany,,,,,Germany,germany,
serengeti-national-park-and-its-highway-tanzania,,,,east-african-court-of-justice,East African Court of Justice,,EACJ,,,,,
subernarekha-multipurpose-project-chandil-dam-jharkhand-india,,https://www.nabard.org/english/home.aspx,,national-bank-for-agriculture-and-rural-development,National Bank for Agriculture and Rural Development,,NABARD,Sanctioned a loan of Rs 118 crore for the construction of the project,,India,india,
subernarekha-multipurpose-project-chandil-dam-jharkhand-india,,www.worldbank.org,,world-bank,The World Bank,,WB,"Initially sanctioned $127mn, but the funding was later withdrawn following the protest by the locals",,United States of America ,united-states-of-america,
gemini-solar-project,,https://www.quinbrook.com/,,quinbook-infrastructure-partners,Quinbook Infrastructure Partners,,,,"Quinbrook Infrastructure Partners (‘Quinbrook’) is a specialist investment manager focused exclusively on lower carbon and renewable energy infrastructure investment and operational asset management in the US, UK and Australia.",,,
mekin-hydroelectric-dam,,http://www.eximbank.gov.cn/,,china-exim-bank,China Export Import Bank,,Chexim,,"Chinese institution that provides financial support to promote the export of Chinese products and services mainly in the infrastructure fields (roads, power plants, oil and gas pipelines, telecom, and water projects).",China,china,
procana-sugar-plantation-limpopo-mozambique,,www.worldbank.org,,world-bank,The World Bank,,WB,,,United States of America ,united-states-of-america,
mount-coffee-hydropower-project-liberia,,https://www.kfw-entwicklungsbank.de/International-financing/KfW-Entwicklungsbank/,,kfw-development-bank,KfW Development Bank,,KfW,,German government-owned development bank,Germany,germany,
mount-coffee-hydropower-project-liberia,,http://www.eib.org/,,european-investment-bank25, European Investment Bank,,EIB,,"Bank owned by and representing the interests of the European Union Member States,  the world’s largest multilateral borrower and lender.",,,
mount-coffee-hydropower-project-liberia,,,,government-of-norway,Government of Norway,,GoN,,,Norway,norway,
mount-coffee-hydropower-project-liberia,,https://www.mcc.gov/about,,millenium-challenge-corporation,Millenium Challenge Corporation,,MCC,Donor,The Millennium Challenge Corporation (MCC) is an U.S. foreign assistance agency that is helping lead the fight against global poverty through the promotion of economic growth.,United States of America ,united-states-of-america,
pollution-of-begejac-channel-kula-serbia,,http://europa.eu/index_en.htm,,european-union,European Union,,EU,Investor in  “Waste water treatment and sewage collection project Vrbas/Kula”,Politico-economic union of 28 member states that are primarily located in Europe.,,,
shenzhou-mining-claver-mineral-development-corporation-nickel-mining-in-claver-philippines,,http://www.cinda.com.hk/e/,,cinda-international-holding-ltd,Cinda International Holding Ltd.,,,"investment, finance",Cinda International is the investment-banking arm of the Cinda Group.,"Hong Kong SAR, China",hong-kong-sar-china,
yala-swamp-large-scale-farming-kenya,,http://europa.eu/index_en.htm,,european-union,European Union,,EU,,Politico-economic union of 28 member states that are primarily located in Europe.,,,
yala-swamp-large-scale-farming-kenya,,,,spanish-embassy,Spanish Embassy,,,,,Spain,spain,
chalillo-dam-belize,,,,canadian-international-development-agency,Canadian International Development Agency,,CIDA,,,Canada,canada,
akosombo-hydroelectric-project-ghana,,https://www.escamp.lk/,,the-world-bank,The	World Bank	,,"ESCAMP ,WB",,The World Bank is an international financial institution that provides loans troug ESCAMP project to build a road in rain forest,United States of America ,united-states-of-america,
akosombo-hydroelectric-project-ghana,,"http://web.worldbank.org/WBSITE/EXTERNAL/EXTABOUTUS/EXTIBRD/0,,menuPK:3046081~pagePK:64168427~piPK:64168435~theSitePK:3046012,00.html",,international-bank-for-reconstruction-and-development,International Bank For Reconstruction And Development,,IBRD,,,,,
anti-privatization-struggle-due-to-the-osorno-water-crisis,,,,world-bank-ciadi,World Bank CIADI,,,,Arbitrage tribunal to guarantee foreign investments.,United States of America ,united-states-of-america,
industrial-wind-energy-project-by-valeco-in-peret-bel-air-and-davignac-puy-peret,,https://www.credit-agricole.com/le-groupe/decouvrir-le-groupe-credit-agricole,,credit-agricole,Crédit Agricole,,,,,France,france,
salar-del-hombre-muerto-litio-argentina,,"http://bidcomunidades.iadb.org/es/banco-interamericano-de-desarrollo,2837.html",,banco-interamericano-de-desarrollo-bid,Banco Interamericano de Desarrollo (BID) ,,BID ,,"El Banco Interamericano de Desarrollo (BID) es una organización financiera internacional con sede en la ciudad de Washington D.C. (Estados Unidos), y creada en el año de 1959 con el propósito de financiar proyectos viables de desarrollo económico, social e institucional y promover la integración comercial regional en el área de América Latina y el Caribe.",United States of America ,united-states-of-america,
salar-del-hombre-muerto-litio-argentina,,,,corporacion-financiera-internacional-del-banco-mundial,Corporación Financiera Internacional del Banco Mundial,,,,,,,
salar-del-hombre-muerto-litio-argentina,,,,fondo-monetario-internacional-fmi,Fondo Monetario Internacional (FMI),,,,,,,
aggressive-seed-laws-in-ghana,,www.worldbank.org,,world-bank,The World Bank,,WB,,,United States of America ,united-states-of-america,
aggressive-seed-laws-in-ghana,,,,g8-new-alliance-for-food-security-and-nutrition,G8  New Alliance for Food Security and Nutrition,,,,,,,
amritsar-delhi-industrial-corridor,,www.worldbank.org,,world-bank,The World Bank,,WB,,,United States of America ,united-states-of-america,
nam-ngum-2-dam-displaced-over-6000-ethnic-minorities-in-vientiane-lao-pdr,,http://www.kasikornbank.com,,kasikorn-bank,Kasikorn Bank,,,,A Thai banking company.,Thailand,thailand,
nam-ngum-2-dam-displaced-over-6000-ethnic-minorities-in-vientiane-lao-pdr,,http://www.bangkokbank.com/BangkokBank/Pages/homepage.aspx,,bangkok-bank,Bangkok Bank,,,,A Thai banking company,Thailand,thailand,
nam-ngum-2-dam-displaced-over-6000-ethnic-minorities-in-vientiane-lao-pdr,,http://www.scb.co.th/th/home,,siam-commercial-bank-public-company-limited,Siam Commercial Bank Public Company Limited,,SCB,,A Thai company engaged in banking and finance,Thailand,thailand,
nam-ngum-2-dam-displaced-over-6000-ethnic-minorities-in-vientiane-lao-pdr,,http://www.ktb.co.th,,krungthai-bank-pcl,Krungthai Bank PCL,,,,A Thai banking company,Thailand,thailand,
water-conflict-nestle-waters-in-vittel,,https://www.eau-rhin-meuse.fr/,,agence-de-leau-rhin-meuse,Agence de l'eau Rhin-Meuse,,,,"""Pour prévenir et limiter les atteintes aux milieux naturels liées à nos différents usages de l’eau au quotidien, l’agence de l’eau Rhin-Meuse, opérateur de l’État, apporte ses connaissances, ses compétences et ses financements nécessaires à la mise en place des actions vertueuses en faveur des ressources en eau et des milieux aquatiques sur son territoire d’intervention.""",France,france,
las-luchas-contra-el-mega-proyecto-del-arco-minero-del-orinoco,,,,world-bank-ciadi,World Bank CIADI,,,,Arbitrage tribunal to guarantee foreign investments.,United States of America ,united-states-of-america,
mose-project-in-venetian-lagoon,,http://www.eib.org,,european-investment-bank,European Investment Bank,,EIB,,,,,
carretera-mulalo-loboguerrero-en-el-valle-colombia,,http://www.caf.com/es,,corporacion-andina-de-fomento,Corporación Andina de Fomento,,CAF,Financiador,,Venezuela,venezuela,
carretera-mulalo-loboguerrero-en-el-valle-colombia,,"http://www.iadb.org/en/about-us/about-the-inter-americahttp://www.iadb.org/en/inter-american-development-bank,2837.htmln-development-bank,5995.html",,inter-american-development-bank,Inter-American Development Bank,,IADB,Financiador,,,,
carretera-mulalo-loboguerrero-en-el-valle-colombia,,,,corporacion-financiera-internacional,Corporación financiera Internacional,,CFI,Financiador,,,,
unsanitary-landfill-vrtijeljka-montenegro,,,,european-commission,European Commission ,,EC,Financing the preparation of technical documentation and remediation,,,,
unsanitary-landfill-vrtijeljka-montenegro,,http://www.eib.org,,european-investment-bank,European Investment Bank,,EIB,Financing the preparation of technical documentation and remediation,,,,
urban-waste-incinerator-of-acerra,,https://www.abi.it,,associazione-bancaria-italiana,Associazione Bancaria Italiana,,Abi,,,Italy,italy,
urban-waste-incinerator-of-acerra,,,,capitalia-spa,Capitalia spa,,,,,Italy,italy,
urban-waste-incinerator-of-acerra,,http://www.intesasanpaolo.com/,,banca-intesa,Banca Intesa,,,,,Italy,italy,
urban-waste-incinerator-of-acerra,,http://www.intesasanpaolo.com/,,san-paolo-imi,San Paolo Imi,,,,,Italy,italy,
urban-waste-incinerator-of-acerra,,https://www.unicredit.it/,,gruppo-unicredito-italiano,Gruppo Unicredito Italiano,,,,,Italy,italy,
tipnis,,https://www.bndes.gov.br/wps/portal/site/home,,bndes,Banco Nacional de Desenvolvimento Econômico e Social,,BNDES,,"Banco Nacional de Desarrollo, Brasil",Brazil,brazil,
karuturi-global-plants-sugar-and-other-crops-in-gambela-ethiopia,,,,commercial-bank-of-ethiopia,Commercial Bank of Ethiopia,,,,,Ethiopia,ethiopia,
acueducto-ii-agravante-del-conflicto-hidrico-en-queretaro,,,,fondo-nacional-de-infraestructura,Fondo Nacional de Infraestructura  ,,,,,,,
acueducto-ii-agravante-del-conflicto-hidrico-en-queretaro,,https://www.gob.mx/banobras,,banco-nacional-de-obras-y-servicios-publicos,Banco Nacional de Obras y Servicios Públicos,,BANOBRAS,,,Mexico,mexico,
acueducto-ii-agravante-del-conflicto-hidrico-en-queretaro,,,,proactiva-medio-ambiente-mexico,Proactiva Medio Ambiente México ,,,,,,,
acueducto-ii-agravante-del-conflicto-hidrico-en-queretaro,,,,veolia-water-solutions-tecnologies,Veolia Water Solutions & Tecnologies ,,,,,,,
acueducto-ii-agravante-del-conflicto-hidrico-en-queretaro,,,,grupo-ica,Grupo ICA ,,,,,,,
san-roque-multipurpose-project,,http://www.jbic.go.jp/en,,japan-bank-for-international-cooperation,Japan Bank for International Corporation,,JBIC,,,Japan,japan,
mambilla-hydropower-station-project-nigeria,,,,export-import-bank-of-china,Export-Import Bank of China,,,China’s Export-Import Bank will provide 85 percent of the funding and Nigeria’s government will supply the remaining 15 percent for the joint venture,,China,china,
anti-mining-protests-and-controversies-around-the-law-with-the-long-name,,www.worldbank.org,,world-bank,The World Bank,,WB,,,United States of America ,united-states-of-america,
desplazamiento-forzado-en-nombre-de-la-conservacion-de-areas-protegidas-comunidad-de-laguna-larga-peten-guatemala,,https://www.wcs.org/,,wildlife-conservation-society,Wildlife Conservation Society,,WCS,,Wildlife Conservation Society (WCS) was founded in 1895 as the New York Zoological Society (NYZS) and currently works to conserve more than two million square miles of wild places around the world.,United States of America ,united-states-of-america,
desplazamiento-forzado-en-nombre-de-la-conservacion-de-areas-protegidas-comunidad-de-laguna-larga-peten-guatemala,,http://www.usaid.gov/,,united-states-agency-for-international-development-usaid,United States Agency for International Development (USAID)  ,,USAID,,"an independent agency of the U.S. federal government that is primarily responsible for administering civilian foreign aid and development assistance. With a budget of over $27 billion, USAID is one of the largest official aid agencies in the world and accounts for more than half of all U.S. foreign assistance—the highest in the world in absolute dollar terms.",United States of America ,united-states-of-america,
desplazamiento-forzado-en-nombre-de-la-conservacion-de-areas-protegidas-comunidad-de-laguna-larga-peten-guatemala,,http://www.rainforest-alliance.org/es,,rainforest-alliance,Rainforest Alliance,,,,Asesoría técnica a proyectos REDD+ GuateCarbon,United States of America ,united-states-of-america,
desplazamiento-forzado-en-nombre-de-la-conservacion-de-areas-protegidas-comunidad-de-laguna-larga-peten-guatemala,,"http://bidcomunidades.iadb.org/es/banco-interamericano-de-desarrollo,2837.html",,banco-interamericano-de-desarrollo-bid,Banco Interamericano de Desarrollo (BID) ,,BID ,,"El Banco Interamericano de Desarrollo (BID) es una organización financiera internacional con sede en la ciudad de Washington D.C. (Estados Unidos), y creada en el año de 1959 con el propósito de financiar proyectos viables de desarrollo económico, social e institucional y promover la integración comercial regional en el área de América Latina y el Caribe.",United States of America ,united-states-of-america,
prodesis-project-in-chiapas-mexico,,http://europa.eu/index_en.htm,,european-union,European Union,,EU,,Politico-economic union of 28 member states that are primarily located in Europe.,,,
wastepickers-against-pollution-and-public-policy-in-federal-district,,https://www.escamp.lk/,,the-world-bank,The	World Bank	,,"ESCAMP ,WB",,The World Bank is an international financial institution that provides loans troug ESCAMP project to build a road in rain forest,United States of America ,united-states-of-america,
palawan-oil-palm-plantations-and-land-grabbing-philippines,,https://www.landbank.com,,land-bank-of-the-philippines,Land Bank of the Philippines ,,,Financing of smallholder farmers,Government financial institution,Philippines,philippines,
expansion-of-cattle-industry-of-agropecuaria-santa-barbara-xinguara-in-para,,,,opportunity-fund,Opportunity Fund,,,,,Brazil,brazil,
laiban-dam-new-centennial-water-source-project-ncws-quezon-philippines,,www.worldbank.org,,world-bank,The World Bank,,WB,,,United States of America ,united-states-of-america,
laiban-dam-new-centennial-water-source-project-ncws-quezon-philippines,,http://www.pnb.com.ph/,,philippine-national-bank,Philippine National Bank,,PNB,"finance, banking, investment",,Philippines,philippines,
laiban-dam-new-centennial-water-source-project-ncws-quezon-philippines,,http://www.adb.org/,,asian-development-bank,Asian Development Bank,,ADB,,"The ADB is a regional development banking, funding development projects in Asian countries",,,
plomin-power-station-unit-c-croatia,,http://www.ca-cib.com/hr-section/welcome.htm,,credit-agricole-cib,Credit Agricole CIB,,,,A French network of cooperative and mutual banks. Financial adviser on the Plomin C project. ,France,france,
cancellation-of-alndfill-in-fujimae-tidal-flat-and-garbage-reduction-effort-by-citizen,,https://www.ramsar.org/,,ramsar-convention,Ramsar convention,,,,,,,
guadalito-y-chiquita-against-oil-palm-companies-ecuador,,https://www.ilo.org,,international-labour-organization,International Labour Organization,,ILO,,"The International Labour Organization (ILO) is devoted to promoting social justice and internationally recognized human and labour rights, pursuing its founding mission that social justice is essential to universal and lasting peace.
Only tripartite U.N. agency, the ILO brings together governments, employers and workers representatives of 187 member States , to set labour standards, develop policies and devise programmes promoting decent work for all women and men.
Today, the ILO's Decent Work agenda  helps advance the economic and working conditions that give all workers, employers and governments a stake in lasting peace, prosperity and progress.",Switzerland,switzerland,
kali-gandaki-hydroelectric-project-a-nepal,,http://www.adb.org/,,asian-development-bank,Asian Development Bank,,ADB,,"The ADB is a regional development banking, funding development projects in Asian countries",,,
kali-gandaki-hydroelectric-project-a-nepal,,http://www.jbic.go.jp/en,,japan-bank-for-international-cooperation,Japan Bank for International Corporation,,JBIC,,,Japan,japan,
kali-gandaki-hydroelectric-project-a-nepal,,,,ministry-of-foreign-affairs-yo-development-cooperation,Ministry of Foreign Affairs ﾖ Development Cooperation,,FINNIDA,,,Finland,finland,
kali-gandaki-hydroelectric-project-a-nepal,,http://www.undp.org/content/undp/en/home.html,,united-nations-development-programme,United Nations Development Programme,,UNDP,,"Involved in integrated conservation and development project, as a donor, as listed in the Project Details section.",United States of America ,united-states-of-america,
san-andres-copan-honduras,,,,banco-atlantida,Banco Atlantida,,,,,Honduras,honduras,
waste-incineration-bielsko-biala-silesia-poland,,http://www.eib.org,,european-investment-bank,European Investment Bank,,EIB,,,,,
transport-corridor-vc-lot-3-bosnia-and-herzegovina,,http://www.ebrd.com/pages/homepage.shtml,,european-bank-for-reconstruction-and-development-ebrd,European Bank for Reconstruction and Development,,EBRD,,"The European Bank for Reconstruction and Development Is a multilateral development bank owned by 64 countries, the European Union and the European Investment Bank. It is the largest financial investor  from central Europe to central Asia and the southern and eastern Mediterranean.",,,
transport-corridor-vc-lot-3-bosnia-and-herzegovina,,http://www.eib.org,,european-investment-bank,European Investment Bank,,EIB,,,,,
lenya-proposed-national-park-tanintharyi-region-myanmar,,https://www.iucn.org/,,iucn,International Union for the Conservation of Nature,,IUCN ,,"The International Union for Conservation of Nature (IUCN) is a membership Union uniquely composed of both government and civil society organisations. It provides public, private and non-governmental organisations with the knowledge and tools that enable human progress, economic development and nature conservation to take place together.",,,
lenya-proposed-national-park-tanintharyi-region-myanmar,,https://www.fauna-flora.org/,,flora-fauna-international-ffi,Flora & Fauna International (FFI),,FFI,Project leader,A non-governmental conservation organization active worldwide,United Kingdom,united-kingdom,
tarbela-dam-pakistan,,www.worldbank.org,,world-bank,The World Bank,,WB,,,United States of America ,united-states-of-america,
tarbela-dam-pakistan,,,,international-development-association,International Development Association,,IDA,,,,,
tarbela-dam-pakistan,,,,asian-infrastructure-investment-bank-aiib,Asian Infrastructure Investment Bank,,AIIB,"The Project, to be co-financed with the World Bank (WB), comprises the installation of a power house at the fifth tunnel (Tunnel 5) of the Tarbela Dam, and construction of a transmission line to connect the power to the national grid. The WB’s co-financing will be in the form of an Additional Financing (AF) for the existing WB-financed Tarbela Fourth Extension Hydropower Project (T4HP). The Tarbela Dam was originally constructed in the 1970s.",,,,
let-vrbas-river-flow,,http://mbb.ag/,,mbb-uws-energy-gmbh,MBB UWS Energy GmbH ,,MBB,,"The company is based in Munich, Germany, and is part of Daimler-Chrysler corporation",Germany,germany,
liquefied-natural-gas-project-papua-new-guinea,,,,export-credit-agency-of-italy,Export Credit Agency of Italy,,SACE,,,Italy,italy,
liquefied-natural-gas-project-papua-new-guinea,,https://www.exim.gov/,,export-import-bank-of-the-united-states,Export-Import Bank of the United States,,Ex-Im US,,,United States of America ,united-states-of-america,
liquefied-natural-gas-project-papua-new-guinea,,,,export-import-bank-of-china,Export-Import Bank of China,,,,,China,china,
liquefied-natural-gas-project-papua-new-guinea,,http://www.jbic.go.jp/en,,japan-bank-for-international-cooperation,Japan Bank for International Corporation,,JBIC,,,Japan,japan,
liquefied-natural-gas-project-papua-new-guinea,,http://www.exportfinance.gov.au/,,australia-export-finance-and-insurance-corporation,Export Finance Australia,,EFA,,Previously known as Australia Export Finance and Insurance Corporation.,Australia,australia,
liquefied-natural-gas-project-papua-new-guinea,,,,international-petroleum-investment-company,International Petroleum Investment Company,,IPIC,,,United Arab Emirates,united-arab-emirates,
