UID,supporters,url,local_names,slug,name,parent,acronym,involvement,description,country.name,country.slug,country
hidralia-guatemala,,http://www.cifidc.com/es,,inter-american-investment-corporation,Corporación Interamericana para el Financiamiento de la Infraestructura,,CIFI,,,,,
hidralia-guatemala,,http://www.bankia.es/en/home,,bankia,Bankia,,,As investor of CIFI,,Spain,spain,
hidralia-guatemala,,http://www.bcie.org/?lang=es,,banco-centroamericano-de-integracion-economica,Banco Centroamericano de Integración Económica  ,,BCIE,As investor of CIFI,,,,
hidralia-guatemala,,www.worldbank.org,,world-bank,The World Bank,,WB,As investor of CIFI,,United States of America ,united-states-of-america,
hidralia-guatemala,,"http://www.iadb.org/en/about-us/about-the-inter-americahttp://www.iadb.org/en/inter-american-development-bank,2837.htmln-development-bank,5995.html",,inter-american-development-bank,Inter-American Development Bank,,IADB,As investor of CIFI,,,,
polish-road-construction-in-natura-2000-site,,http://www.eib.org,,european-investment-bank,European Investment Bank,,EIB,,,,,
polish-road-construction-in-natura-2000-site,,www.worldbank.org,,world-bank,The World Bank,,WB,,,United States of America ,united-states-of-america,
polish-road-construction-in-natura-2000-site,,https://ec.europa.eu/regional_policy/en/funding/cohesion-fund/,,cohesion-fund-eu,Cohesion Fund (EU),,CF,Financing source (45% of total construction costs),"It is one of the five European Structural and Investment Funds of the European Union, provides support to Member States with a gross national income (GNI) per capita below 90% EU-27 average to strengthen the economic, social and territorial cohesion of the EU.

The Cohesion Fund supports investments in the field of environment and Trans-European Networks in the area of transport infrastructure (TEN-T).",,,
marange-diamond-land-and-human-rights-abuses-zimbabwe,,,,un-kimberley-process,UN Kimberley Process,,KP,,,,,
logistics-hub-trans-shipment-port-in-portland-bight-jamaica,,www.worldbank.org,,world-bank,The World Bank,,WB,,,United States of America ,united-states-of-america,
sumsel-1-coal-fired-power-plant-south-sumatra-indonesiaa,,http://www.ccb.com/,,china-construction-bank,China Construction Bank,,CCB,,"China Construction Bank Corporation, headquartered in Beijing, is a large-scale joint stock commercial bank leading in China. Its predecessor China Construction Bank was established in October 1954. It was listed on Hong Kong Stock Exchange in October 2005(stock code: 939) and the Shanghai Stock Exchange in September 2007 (stock code:601939). At the end of 2016, the Bank’s market capitalization reached US$192,626 million, ranking fifth among all listed banks in the world. In terms of Tier 1 capital, the Group ranked second among the World’s Top 1000 Banks by the UK magazine The Banker in 2016.

With 14,985 banking stores and 362,482 staff members, the Bank provides services to hundreds of millions of personal and corporate customers, and maintains close cooperation with leading enterprises in strategic industries in the Chinese economy and numerous high-end customers. The Bank has commercial banking branches and subsidiaries in 29 countries and regions with 251 overseas entities, and its subsidiaries cover various industries, including asset management, financial leasing, trust, life insurance, property & casualty insurance, investment bank, futures and pension.

By accelerating the process of transformation and development toward being an innovative integrated banking group with multi-functional and smart services as well as intensive management, the Bank commits to developing itself into a bank with top value creation capability. The Bank strives to achieve the balance between short-term and long-term benefits, between business goals and social responsibilities, so as to maximize the value for customers, shareholders, society and its associates. [accessed on 2017-11-24]",China,china,
sumsel-1-coal-fired-power-plant-south-sumatra-indonesiaa,,http://www.boc.cn/en/,,bank-of-china,Bank of China,,BOC,,The Bank of China (BOC; Chinese: 中国银行) is a Chinese national commercial bank headquartered in Beijing and the fourth largest bank in the world.,China,china,
sumsel-1-coal-fired-power-plant-south-sumatra-indonesiaa,,http://www.icbc.com.cn/icbc/en/,,industrial-and-commercial-bank-of-china22,Industrial and Commercial Bank of China,,ICBC,,"Industrial and Commercial Bank of China Limited (ICBC; Chinese: 中国工商银行) is a Chinese multinational bank. Founded as a limited company on 1 January 1984, ICBC is a state-owned commercial bank.",China,china,
vedanta-and-konkola-zambia,,www.worldbank.org,,world-bank,The World Bank,,WB,,,United States of America ,united-states-of-america,
vedanta-and-konkola-zambia,,  http://www.imf.org/external/index.htm,,fondo-monetario-internacional,International Monetary Fund,,FMI,,"El Fondo Monetario Internacional o FMI (en inglés: International Monetary Fund) es una institución internacional que en la actualidad reúne a 188 países, y cuyo papel, según sus estatutos, es «fomentar la cooperación monetaria internacional; facilitar la expansión y el crecimiento equilibrado del comercio internacional; fomentar la estabilidad cambiaria; contribuir a establecer un sistema multilateral de pagos para las transacciones corrientes entre los países miembros y eliminar las restricciones cambiarias que dificulten la expansión del comercio mundial; infundir confianza a los países miembros poniendo a su disposición temporalmente y con las garantías adecuadas los recursos del Fondo, dándoles así oportunidad de que corrijan los desequilibrios de sus balanzas de pagos sin recurrir a medidas perniciosas para la prosperidad nacional o internacional, para acortar la duración y aminorar el desequilibrio de sus balanzas de pagos».1 Su sede se encuentra en Washington, la capital de Estados Unidos",,,
national-park-sjeverni-velebit-croatia,,www.worldbank.org,,world-bank,The World Bank,,WB,Provided the Croatian government with a  loan for for establishment of the NATURA 2000 network of protected areas,,United States of America ,united-states-of-america,
national-park-sjeverni-velebit-croatia,,http://ec.europa.eu/regional_policy/en/information/legislation/regulations/2007-2013/,,european-union7,European Union ,,EU,Investor (95% share) through Structural Funds and Cohesion Fund 2007-2013,,,,
sasan-ultra-mega-power-project-india,,www.worldbank.org,,world-bank,The World Bank,,WB,,,United States of America ,united-states-of-america,
sasan-ultra-mega-power-project-india,,,,state-bank-of-india,State Bank of India,,,,,India,india,
sasan-ultra-mega-power-project-india,,http://www.boc.cn/en/,,bank-of-china,Bank of China,,BOC,,The Bank of China (BOC; Chinese: 中国银行) is a Chinese national commercial bank headquartered in Beijing and the fourth largest bank in the world.,China,china,
sasan-ultra-mega-power-project-india,,http://english.eximbank.gov.cn/en/,,china-export-import-bank,China Export Import Bank,,China Exim,,,China,china,
sasan-ultra-mega-power-project-india,,https://www.exim.gov/,,export-import-bank-of-the-united-states,Export-Import Bank of the United States,,Ex-Im US,,,United States of America ,united-states-of-america,
sasan-ultra-mega-power-project-india,,,,standard-chartered-bank,Standard Chartered Bank,,,,,United Kingdom,united-kingdom,
sasan-ultra-mega-power-project-india,,http://www.cdb.com.cn/english/,,china-development-bank,China Development Bank,,CDB,,,China,china,
myanmar-ayeyarwady-integrated-river-basin-management-project-airbmp,,www.worldbank.org,,world-bank,The World Bank,,WB,,,United States of America ,united-states-of-america,
deforestacion-en-loreto-y-ucayali-por-grupo-melka,,http://www.rainforest-alliance.org/es,,rainforest-alliance,Rainforest Alliance,,,,Asesoría técnica a proyectos REDD+ GuateCarbon,United States of America ,united-states-of-america,
wind-farm-cdm-project-in-kalpavalli-community,,https://cdm.unfccc.int/about/index.html,,united-nations-framework-convention-on-climate-change,United Nations Framework Convention on Climate Change/CDM,,UNFCC,,"With 196 Parties, the United Nations Framework Convention on Climate Change (UNFCCC) has near universal membership and is the parent treaty of the 1997 Kyoto Protocol. The Kyoto Protocol has been ratified by 192 of the UNFCCC Parties. 
            The ultimate objective of both treaties is to stabilize greenhouse gas concentrations in the atmosphere at a level that will prevent dangerous human interference with the climate system.
            The CDM allows emission-reduction projects in developing countries to earn certified emission reduction (CER) credits, each equivalent to one tonne of CO2. These CERs can be traded and sold, and used by industrialized countries to a meet a part of their emission reduction targets under the Kyoto Protocol.
            The mechanism stimulates sustainable development and emission reductions, while giving industrialized countries some flexibility in how they meet their emission reduction limitation targets.
            The CDM is the main source of income for the UNFCCC Adaptation Fund, which was established to finance adaptation projects and programmes in developing country Parties to the Kyoto Protocol that are particularly vulnerable to the adverse effects of climate change. The Adaptation Fund is financed by a 2% levy on CERs issued by the CDM.",,,
mulanje-massif-rare-earth-mineral-exploration-malawi,,www.worldbank.org,,world-bank,The World Bank,,WB,,,United States of America ,united-states-of-america,
mulanje-massif-rare-earth-mineral-exploration-malawi,,,,mulanje-conservation-trust,Mulanje Conservation Trust,,MCC,,,,,
mulanje-massif-rare-earth-mineral-exploration-malawi,,https://www.afdb.org/en,,african-development-bank,African Development Bank,,AfDB,,The African Development Bank is a multilateral development finance institution. ] Its mission is to fight poverty and improve living conditions on the continent through promoting the investment of public and private capital in projects and programs that are likely to contribute to the economic and social development of the region.,,,
yanacocha-mine-peru,,www.worldbank.org,,world-bank,The World Bank,,WB,,,United States of America ,united-states-of-america,
vaike-oismae-park-housing-area,,www.tallinn.ee,,tallinn-city,Tallinn City,,"Tallinn, Reval",financier,,Estonia,estonia,
vaike-oismae-park-housing-area,,https://ec.europa.eu/,,european-union-taxpayers,European Union Taxpayers,,EU,Unclear if involved,"The project destroying European cultural (architecture) heritage and 2399 peoples homes and health is financed 85% by EU taxpayers money. 
Whereas Estonian State and Tallinn City have stated that financier is EU (ERDF), EU Control Board - office of Juhan Parts - claim that EU do not finance the project.
http://ec.europa.eu/regional_policy/en/funding/erdf/",Belgium,belgium,
open-air-mine-exploitation-of-uranium-in-spain-portugal-border-spain,,,,european-commission-euratom-and-other-directives-and-regulations,European Commission (Euratom and other Directives and Regulations),,,,,,,
standard-gauge-railway-project-from-mombasa-to-nairobi-kenya,,http://www.eximbank.gov.cn/,,china-exim-bank,China Export Import Bank,,Chexim,,"Chinese institution that provides financial support to promote the export of Chinese products and services mainly in the infrastructure fields (roads, power plants, oil and gas pipelines, telecom, and water projects).",China,china,
veracel-celulose-brazil,,http://www.eib.org,,european-investment-bank,European Investment Bank,,EIB,,,,,
veracel-celulose-brazil,,,,nordic-investment-bank,Nordic Investment Bank,,NIB,,,Finland,finland,
adb-embankment-subproject-in-the-brahmaputra-river-of-kaziranga-assam,,http://www.adb.org/,,asian-development-bank,Asian Development Bank,,ADB,,"The ADB is a regional development banking, funding development projects in Asian countries",,,
pungarayacu-oil-block-ecuador,,https://www.ilo.org,,international-labour-organization,International Labour Organization,,ILO,,"The International Labour Organization (ILO) is devoted to promoting social justice and internationally recognized human and labour rights, pursuing its founding mission that social justice is essential to universal and lasting peace.
Only tripartite U.N. agency, the ILO brings together governments, employers and workers representatives of 187 member States , to set labour standards, develop policies and devise programmes promoting decent work for all women and men.
Today, the ILO's Decent Work agenda  helps advance the economic and working conditions that give all workers, employers and governments a stake in lasting peace, prosperity and progress.",Switzerland,switzerland,
pungarayacu-oil-block-ecuador,,,,inter-american-commission-on-human-rights,Inter-American Commission on Human Rights,,,,,,,
dakota-access-pipeline,,,,citibank,Citybank,,,,,United States of America ,united-states-of-america,
dakota-access-pipeline,,wellsfargo.com,,wells-fargo,Wells Fargo,,WFC,,Multinational banking and financial services holding company based out of San Francisco. One of the Big Four Banks of the U.S.,United States of America ,united-states-of-america,
dakota-access-pipeline,,http://www.bnpparibas.com/,,bnp-paribas,BNP Paribas,,BNP,,,France,france,
dakota-access-pipeline,,,,suntrust,SunTrust,,,,SunTrust bank merged with BB&T to form Truist Financial Corporation in 2019,United States of America ,united-states-of-america,
dakota-access-pipeline,,www.rbs.co.uk,,royal-bank-of-scotland,Royal Bank of Scotland,,RBS,,Scottish banking and insurance holding corporation.,United Kingdom,united-kingdom,
dakota-access-pipeline,,http://www.bk.mufg.jp/global/,,bank-of-tokyo-mitsubishi-ufj,The Bank of Tokyo Mitsubishi UFJ,,MUFG,,"Largest bank in Japan, eighth largest in the world according to Bloomberg. Serves as the core retail, corporate, and investment banking arm of the Mitsubishi UFJ Financial Group.",Japan,japan,
dakota-access-pipeline,,https://mizuhogroup.com/,,mizuho-bank,Mizuho Bank,,Mizuho,,The third largest financial service private company in Japan,Japan,japan,
dakota-access-pipeline,,,,td-securities,TD Securities,,,,,,,
dakota-access-pipeline,,https://www.abnamro.com/en/investor-relations/debt-investors/capital/index.html,,abn-amro-capital,ABN AMRO Capital,,,,,,,
dakota-access-pipeline,,http://www.ing.com/en.htm,,ing-bank-nv,ING Bank NV,,,,,Netherlands,netherlands,
dakota-access-pipeline,,https://www.dnb.no/en,,norways-largest-financial-services-group, Norway's largest financial services group,,DnB NOR ASA,,,Norway,norway,
dakota-access-pipeline,,https://www.icbc.com/,,industrial-and-commercial-bank-of-china17,Industrial and Commercial Bank of China ,,ICBC,,,China,china,
dakota-access-pipeline,,http://www.smbcnikko.co.jp/en/,,smbc-nikko-securities,SMBC Nikko Securities,,,,,Japan,japan,
dakota-access-pipeline,,https://www.sgcib.com/en/contact/,,societe-generale-corporate-investment-banking,Société Générale Corporate & Investment Banking ,,SGCIB,,,France,france,
marcopper-placer-dome-mining-disaster-marinduque-island-philippines,,http://www.adb.org/,,asian-development-bank,Asian Development Bank,,ADB,,"The ADB is a regional development banking, funding development projects in Asian countries",,,
marcopper-placer-dome-mining-disaster-marinduque-island-philippines,,,,solidbank-corporation,Solidbank Corporation,,,"finance, banking",,Philippines,philippines,
marcopper-placer-dome-mining-disaster-marinduque-island-philippines,,http://www.rcbc.com/,,rizal-commercial-banking-corporation-rcbc,Rizal Commercial Banking Corporation (RCBC),,RCBC,"banking, finance",,Philippines,philippines,
potosi-san-bartolome-estabilidad-geologica-del-cerro-rico-patrimonio-de-la-humanidad-bolivia,,www.worldbank.org,,world-bank,The World Bank,,WB,,,United States of America ,united-states-of-america,
potosi-san-bartolome-estabilidad-geologica-del-cerro-rico-patrimonio-de-la-humanidad-bolivia,,,,corporacion-de-inversion-privada-para-el-exterior,Overseas Private Investment Corporation,,,,,United States of America ,united-states-of-america,
potosi-san-bartolome-estabilidad-geologica-del-cerro-rico-patrimonio-de-la-humanidad-bolivia,,,,united-nations-permanent-forum-on-indigenous-issues,United Nations Permanent Forum on Indigenous Issues,,UNPFII,,,,,
potosi-san-bartolome-estabilidad-geologica-del-cerro-rico-patrimonio-de-la-humanidad-bolivia,,http://whc.unesco.org/,,unesco,"UNESCO - United Nations Educational, Scientific and Cultural Organization",,UNESCO,,"UNESCO is the United Nations Educational, Scientific and Cultural Organization. It seeks to build peace through international cooperation in Education, the Sciences and Culture. ",France,france,
potosi-san-bartolome-estabilidad-geologica-del-cerro-rico-patrimonio-de-la-humanidad-bolivia,,,,corporacion-financiera-internacional,Corporación financiera Internacional,,CFI,,,,,
land-grabbing-in-panama-by-navy-and-special-task-force-stf,,www.worldbank.org,,world-bank,The World Bank,,WB,,,United States of America ,united-states-of-america,
desaguadero-oil-spill-transredes-s-a-bolivia,,www.worldbank.org,,world-bank,The World Bank,,WB,,,United States of America ,united-states-of-america,
desaguadero-oil-spill-transredes-s-a-bolivia,,"http://www.iadb.org/en/about-us/about-the-inter-americahttp://www.iadb.org/en/inter-american-development-bank,2837.htmln-development-bank,5995.html",,inter-american-development-bank,Inter-American Development Bank,,IADB,,,,,
desaguadero-oil-spill-transredes-s-a-bolivia,,  http://www.imf.org/external/index.htm,,fondo-monetario-internacional,International Monetary Fund,,FMI,,"El Fondo Monetario Internacional o FMI (en inglés: International Monetary Fund) es una institución internacional que en la actualidad reúne a 188 países, y cuyo papel, según sus estatutos, es «fomentar la cooperación monetaria internacional; facilitar la expansión y el crecimiento equilibrado del comercio internacional; fomentar la estabilidad cambiaria; contribuir a establecer un sistema multilateral de pagos para las transacciones corrientes entre los países miembros y eliminar las restricciones cambiarias que dificulten la expansión del comercio mundial; infundir confianza a los países miembros poniendo a su disposición temporalmente y con las garantías adecuadas los recursos del Fondo, dándoles así oportunidad de que corrijan los desequilibrios de sus balanzas de pagos sin recurrir a medidas perniciosas para la prosperidad nacional o internacional, para acortar la duración y aminorar el desequilibrio de sus balanzas de pagos».1 Su sede se encuentra en Washington, la capital de Estados Unidos",,,
petaquilla-panama,,,,inmet-mining,Inmet Mining,,,,"empresa madre de Minera Panamá, en el cual posee el 80% de las acciones. El restante 20% lo posee el consorcio estatal surcoreano formado por Korea Resources Corp y LS-Nikko Copper Inc. que inyectó $1.400 millones.",Panama,panama,
petaquilla-panama,,,,jp-morgan-credit-suisse-bank-of-america-merrill-lynch-citigroup-morgan-stanley-y-rbc-capital-markets,"J.P. Morgan, Credit Suisse, Bank of America Merrill Lynch, Citigroup, Morgan Stanley y RBC Capital Markets",,,,"Estas empresas actuaron en conjunto para la negociación de los bonos. Las notas tienen una tasa de 8,75% y maduran en 2020, informó Reuters.",,,
petaquilla-panama,,www.jpmorganchase.com/,,jp-morgan-chase-co,JP Morgan Chase,,JPM,,"Largest bank in the United States, 6th largest bank in the world by total assets. One of the Big Four U.S. banks.",United States of America ,united-states-of-america,
petaquilla-panama,,www.citigroup.com/,,citigroup-inc,Citigroup Inc.,,,,A major global banking and finance corporation,United States of America ,united-states-of-america,
petaquilla-panama,,www.morganstanley.com,,morgan-stanley72,Morgan Stanley,,MS,,Financial services corporation. ,United States of America ,united-states-of-america,
petaquilla-panama,,www.rbc.com,,royal-bank-of-canada,Royal Bank of Canada (RBC),,RBC,,"Largest bank in Canada, multinational financial services corporation.",Canada,canada,
jakarta-indonesia-anti-privatization-of-water-supply-and-remunicipalisation-struggle,,www.worldbank.org,,world-bank,The World Bank,,WB,,,United States of America ,united-states-of-america,
sime-darby-plantations-liberia,,,,norwegian-government-pension-fund,Norwegian Government Pension Fund,,,,,Norway,norway,
sime-darby-plantations-liberia,,,,schroder-investment-management,Schroder Investment Management,,,,,United Kingdom,united-kingdom,
sime-darby-plantations-liberia,,,,pensioenfonds-zorg-en-welzijn,Pensioenfonds Zorg en Welzijn,,,,,Netherlands,netherlands,
ongi-river-movement-mongolia,,https://www.worldbank.org/en/home,,world-bank100,World Bank,,WB,,"The Asia Sustainable and Alternative Energy Program (ASTAE), which is a trust fund program, financed a grant for the World Bank team in preparing the groundwork to develop its own lending to the Pavagada Solar Park and a similar project elsewhere in India. ASTAE support has been crucial in allowing the Bank to develop templates for required financial management and procurement actions, as well as the environmental and social screening actions that all solar parks will have to follow if they wish to be sustainable and well managed. It has also helped the World Bank communicate international best practices to the Indian team gearing to implement the solar park.",,,
reppardfjord-nussir-case,,www.credit-suisse.com,,credit-suisse,Credit Suisse,,CS,,Swiss multinational financial services corporation.,Switzerland,switzerland,
seeds-and-the-grey-areas-of-the-european-law-in-austria,,http://europa.eu/index_en.htm,,european-union,European Union,,EU,,Politico-economic union of 28 member states that are primarily located in Europe.,,,
seeds-and-the-grey-areas-of-the-european-law-in-austria,,http://www.upov.int/portal/index.html.en,,union-for-the-protection-of-new-plant-varieties,Union for the Protection of New Plant Varieties,,UPOV,,"The International Union for the Protection of New Varieties of Plants (UPOV) is an intergovernmental organization with headquarters in Geneva (Switzerland).
                        UPOV was established by the International Convention for the Protection of New Varieties of Plants. The Convention was adopted in Paris in 1961 and it was revised in 1972, 1978 and 1991.",Switzerland,switzerland,
threats-facing-the-tana-river-primate-reserve-kenya,,www.worldbank.org,,world-bank,The World Bank,,WB,,,United States of America ,united-states-of-america,
threats-facing-the-tana-river-primate-reserve-kenya,,https://www.thegef.org/about-us,,global-environment-facility,Global Environment Facility,,GEF,,"The Global Environment Facility (GEF) was established on the eve of the 1992 Rio Earth Summit to help tackle our planet’s most pressing environmental problems. The GEF unites 183 countries in partnership with international institutions, civil society organizations (CSOs), and the private sector to address global environmental issues while supporting national sustainable development initiatives.",United States of America ,united-states-of-america,
lucha-binacional-contra-la-cadena-de-proyectos-hidroelectricos-en-el-rio-usumacinta-mexico-y-guatemala,,www.worldbank.org,,world-bank,The World Bank,,WB,,,United States of America ,united-states-of-america,
lucha-binacional-contra-la-cadena-de-proyectos-hidroelectricos-en-el-rio-usumacinta-mexico-y-guatemala,,"http://bidcomunidades.iadb.org/es/banco-interamericano-de-desarrollo,2837.html",,banco-interamericano-de-desarrollo-bid,Banco Interamericano de Desarrollo (BID) ,,BID ,,"El Banco Interamericano de Desarrollo (BID) es una organización financiera internacional con sede en la ciudad de Washington D.C. (Estados Unidos), y creada en el año de 1959 con el propósito de financiar proyectos viables de desarrollo económico, social e institucional y promover la integración comercial regional en el área de América Latina y el Caribe.",United States of America ,united-states-of-america,
himalayan-ski-village,,http://www.naturpolis.fi/eng/,,naturpolis-ltd,Naturpolis Ltd,,,,"Naturpolis Ltd provides profitable travel and tourism, industrial food production, ICT business services in regions of Kuusamo-Taivalkoski in Finland.
",Finland,finland,
himalayan-ski-village,,http://www.finpro.fi/,,finpro,Finpro,,,"As part of these Finnish collaborations, many local skiers were taken on Skiing training Programme to Finland",Finpro is an Helsinki based Investment company which promotes foreign direct investment and tourism in Finland.,Finland,finland,
ogms,,http://www.wto.org/,,world-trade-organisation,World Trade Organisation,,WTO,,International organisation that supervise and liberalize international trade.,,,
total-moil-bemolonga-tar-sands-madagascar,,www.rbs.co.uk,,royal-bank-of-scotland,Royal Bank of Scotland,,RBS,,Scottish banking and insurance holding corporation.,United Kingdom,united-kingdom,
dangerous-changes-in-the-gmo-law-serbia,,http://www.wto.org/,,world-trade-organisation,World Trade Organisation,,WTO,Demand modification of the GMO in order to let Serbia access the EU,International organisation that supervise and liberalize international trade.,,,
dangerous-changes-in-the-gmo-law-serbia,,http://europa.eu/index_en.htm,,european-union,European Union,,EU,Demand modification of the GMO in order to let Serbia access the EU,Politico-economic union of 28 member states that are primarily located in Europe.,,,
dangerous-changes-in-the-gmo-law-serbia,,http://www.donausoja.org/en/danube-soya/about-us/,,danube-soya,Danube Soya,,,"""Danube Soya"" label for GMO-free animal products have been used in Serbia since May 2015","An international non-profit association of 180 meat, eggs and soy producers and retailers established tree years ago in Vienna. ",,,
