UID,name,slug,relations
afectacion-de-los-pueblos-yekwana-y-sanema-por-mineria-ilegal-en-el-rio-caura,"Disputas de los indígenas del Alto Paragua en torno a la minería ilegal en sus territorios, Venezuela  ",disputas-de-los-indigenas-del-alto-paragua-en-torno-a-la-mineria-ilegal-en-sus-territorios,
afectacion-de-los-pueblos-yekwana-y-sanema-por-mineria-ilegal-en-el-rio-caura,"Indígenas  warao (Delta del Orinoco) contaminados por Corporación Venezolana de Guayana y  minería ilegal, Venezuela ",indigenas-warao-en-el-bajo-delta-del-orinoco-contaminados-por-desechos-de-la-corporacion-venezolana-de-guayana-y-de-la-mineria-ilegal,
afectacion-de-los-pueblos-yekwana-y-sanema-por-mineria-ilegal-en-el-rio-caura,"Indígenas yabarana, hoti y e’ñepa afectados por minería ilegal en Manapiare, Venezuela",indigenas-yabarana-hoti-y-enepa-afectados-por-mineria-ilegal-en-el-municipio-manapiare,
afectacion-de-los-pueblos-yekwana-y-sanema-por-mineria-ilegal-en-el-rio-caura,"Pueblos indígenas arawaks del sur afectados por minería ilegal en la cuenca del río Atabapo, Venezuela",pueblos-indigenas-arawaks-del-sur-afectados-por-mineria-ilegal-en-la-cuenca-del-rio-atabapo,
afectacion-de-los-pueblos-yekwana-y-sanema-por-mineria-ilegal-en-el-rio-caura,"Las luchas contra el mega-proyecto del Arco Minero del Orinoco, Venezuela",las-luchas-contra-el-mega-proyecto-del-arco-minero-del-orinoco,
torata,"Minera Aruntani-Arasi y contaminación de ríos en Puno, Peru",minera-aruntani-arasi-y-contaminacion-de-rios-en-puno,
torata,"ASU_Corporación Ananea, La Rinconada",corporacion-ananea-la-rinconada,
multiple-spills-in-biseni-nigeria,"Shell oil exploration and extraction, Nigeria",shell-nigeria,
famatina-gold-mining-argentina,"Josemaria proyecto minería, San Juan, Argentina",josemaria,
vilappilsala-waste-plant-vilappilsala-kerala-india,"Brahmapuram Solid Waste Processing Plant, Kerala, India",brahmapuram-solid-waste-processing-plant,
marlin-guatemala,"Cerro Blanco, Guatemala",cerro-blanco-guatemala,
marlin-guatemala,"Proyecto Minero El Escobal, Guatemala",el-escobal,
marlin-guatemala,"Proyecto Minero Los Chocoyos en Sipakapa, Guatemala",los-chocoyos,
hidralia-guatemala,"Resistencia de los Maya Mam contra proyectos de minería en Huehuetenango, Guatemala ",comunidades-rechazan-expansion-de-mina-marlin-en-huehuetenango-guatemala,
hidralia-guatemala,"Hydropower plants in Yich Ki'sis,  San Mateo Ixtatán, Guatemala",san-mateo-ixtatan,
contamination-in-el-salto-mexico,"Río Atoyac (Tlaxcala-Puebla), infierno ambiental. Mexico ",rio-atoyac-tlaxcala-puebla-an-environmental-hell-mexico,
akkuyu-nuclear-power-plant-turkey,"Sinop Nuclear Power Plant, Turkey",sinop-nuclear-power-plant-turkey,
akkuyu-nuclear-power-plant-turkey,"Radioactive contamination from an old uranium mine, Köprübaşı province, Turkey",radioactive-contamiation-from-the-old-uranium-mine-turkey,
marange-diamond-land-and-human-rights-abuses-zimbabwe,"Bikita Minerals Lithium mine impacts local communities and brings corruption in the Masvingo Province, Zimbabwe ",bikita-minerals-lithium-mine-masvingo-province-zimbabwe-impacts-local-communities-and-brings-corruption,
marange-diamond-land-and-human-rights-abuses-zimbabwe,"Bikita Minerals Lithium mine in the Masvingo Province, Zimbabwe",bikita,
mong-kung-coal-mine-shan-state-myanmar,"Mong Kok (Mai Khot) coal mine and power station, Shan State, Myanmar",mai-khot-mong-kong-coal-power-station-cancelled-over-protests-shan-state-myanmar,
estonias-shale-oi-estonia,"Phosphorite mining, Estonia",phosphorite-mining-estonia,
east-eagle-reliability-project-in-east-boston-by-eversource,"Excess Air Pollution in Chelsea City, Massachusetts",chelsea-city-massachusetts-usa,
general-alvear-suspende-proyecto-de-exeter-mendoza-argentina,"Fracking de petróleo en Mendoza, Argentina",fracking-for-oil-in-mendoza-argentina,
carreteras-en-purus-inapari,Ashaninka of Rio Amônia and Saweto against illegal loggers at border Peru-Brazil,ashaninka-rioamonia-saweto-againstlogging-acre-brazil,
carreteras-en-purus-inapari,"Interoceánica as a driver of deforestation and land use change in Madre de Dios, Peru",interoceanica-as-a-driver-of-deforestation-and-land-use-change-in-madre-de-dios-peru,
vedanta-and-konkola-zambia,"Kangaluwi Copper Mine in the Lower Zambezi National Park, Zambia",proposed-kangaluwi-copper-mine-in-the-lower-zambezi,
alamosgold-morelos-mexico,"Megaproyecto energético Proyecto Integral Morelos, México",lucha-del-frente-de-pueblos-en-defensa-de-la-tierra-y-el-agua-morelos-puebla-tlaxcala-contra-el-proyecto-integral-morelos,
shells-drilling-for-oil-in-the-arctic,"Iñupiat people resist offshore oil drilling and gas development plans in Point Hope, Alaska, USA",inupiat-people-resist-offshore-oil-drilling-and-gas-development-plans-in-point-hope-alaska-usa,
deforestacion-en-loreto-y-ucayali-por-grupo-melka,"Deforestation by Grupo Romero in Amazonia with oil palm plantations, Peru",deforestacion-en-selva-peruana-por-cultivo-de-palma-de-aceite-peru,
deforestacion-en-loreto-y-ucayali-por-grupo-melka,"Santa Clara de Uchunya against palm oil plantation, Peru",santa-clara-de-uchunya,
deforestacion-en-loreto-y-ucayali-por-grupo-melka,"Hidrovía amazónica, Ucayali, Peru",hidrovia-amazonica,
mulanje-massif-rare-earth-mineral-exploration-malawi,"Kanyika Niobium Project, Malawi",kanyika-niobium-project-malawi,
yanacocha-mine-peru,"Conga mining project, Peru",conga,
yanacocha-mine-peru,"Newmont's Ahafo gold mine, Ghana",gold-min,
proyecto-hidroelectrico-veracruz-mexico,"Hidroeléctrica El Naranjal, Veracruz,  Mexico",el-naranjal-veracruz-mexico,
islanders-resisting-nickel-mining-permits-wawonii-southeast-sulawesi-indonesia,"Nickel rush threatens the health and environment of Obi Island's people, Indonesia",local-health-threatened-by-nickel-mining-in-obi-island-indonesia,
islanders-resisting-nickel-mining-permits-wawonii-southeast-sulawesi-indonesia,"Indonesia Morowali Industrial Park (IMIP), Central Sulawesi, Indonesia",indonesia-morowali-industrial-park-imip1,
islanders-resisting-nickel-mining-permits-wawonii-southeast-sulawesi-indonesia,"Delong Nickel Industrial Area, Sulawesi,  Indonesia",delong-nickel-industrial-area-indonesia,
controversy-over-construction-of-the-xiaonanhai-dam-along-the-yangtze-river-in-chongqing-china,"Xiangjiaba Hydropower Plant in Yunnan and Sichuan, southwest China",xiangjiaba-dam-in-yunnan-and-sichuan-southwest-china,
motorway-to-bypass-strasbourg,"The A45 motorway, Lyon, France",the-a45-motorway,
motorway-to-bypass-strasbourg,"Destruction of the Aubervilliers Workers' Gardens, France",destruction-of-the-aubervilliers-workers-gardens-france,
motorway-to-bypass-strasbourg,"La Réunion New Coastal Road, France",la-reunion-coastal-road,
chooz-nuclear-power-plant-meuse-river-france,"Erdeven Nuclear Power Plant, France",erdeven-nuclear-power-plant,
ocespcc-campesinos-ecologistas-de-guerrero-mexico," Muelle de Pie de la Cuesta y muerte de Fabiola Osorio por defender el manglar, Guerrero, Mexico",defensa-del-manglar-guerrero-mexico,
indigenous-communities-of-rio-negro-divided-over-mining-regularization-and-affected-by-commercial-cooptation-and-illegal-mining,"Mining in indigenous territories and the RENCA Amazon reserve, Amapá - Pará, Brazil",commerical-mining-protected-areas-of-renca-para-amapa-brazil,
indigenous-communities-of-rio-negro-divided-over-mining-regularization-and-affected-by-commercial-cooptation-and-illegal-mining,"Illegal gold mining and poaching in Vale do Javari Indigenous Territory, Amazonas, Brazil",illegal-gold-mining-and-poaching-in-vale-do-javari-indigenous-territory-amazonas-brazil,
extension-of-tucurui-transmission-line-to-roraima-brazil,"Road construction through TI Waimiri Atroari, Amazonas - Roraima, Brazil",roraima-transmission-line-on-indigenous-land-roraima-brazil,
extension-of-tucurui-transmission-line-to-roraima-brazil,"Balbina Hydroelectric Dam, Amazonas, Brazil",balbina-hydroelectric-dam-amazonas-brazil,
extension-of-tucurui-transmission-line-to-roraima-brazil,"Illegal logging threatens isolated Pirititi indigenous group, Roraima, Brazil",illegal-logging-in-pirititi-indigenous-territory-roraima-brazil,
standard-gauge-railway-project-from-mombasa-to-nairobi-kenya,"Standard Gauge Railway Project Phase 2A Nairobi-Naivasha, Kenya ",protest-against-chinese-companies-to-build-elevated-railways-hinder-animal-migrationnairobi-kenya,
standard-gauge-railway-project-from-mombasa-to-nairobi-kenya,"Offshore sea sand harvest in Kwale district, south of Mombasa, Kenya",offshore-sea-sand-harvest-from-in-south-coast-of-the-indian-ocean-kenya,
balbina-hydroelectric-dam-amazonas-brazil,"Illegal logging threatens isolated Pirititi indigenous group, Roraima, Brazil",illegal-logging-in-pirititi-indigenous-territory-roraima-brazil,
toxic-spill-from-mining-company-belonging-to-grupo-mexico-sonora-mexico,"Derrame de ácido sulfúrico de Grupo México en el mar de Cortés, Sonora, México",derrame-de-acido-sulfurico-de-grupo-mexico-en-el-mar-de-cortes,
national-grid-pipeline-in-north-brooklyn,"Newtown Creek: Disproportionate Effects of Oil Spills on Communities In Brooklyn and Queens, New York, USA ",newtown-creek-disproportionate-affects-of-oil-spills-on-surroundings-communities-in-brooklyn-and-queens-new-york,
golfech-nuclear-power-plant-france,"Nuclear power plant in Le Carnet, France ",energy-ecological-economics-nuclear-power-plant-in-le-carnet,
angangueo-community-vs-grupo-mexico-michoacan,"Defensa del bosque cobra la vida de líderes ejidatarios Homero Gómez y Raúl Hernández. Reserva de la Biosfera Mariposa Monarca, Michoacán (México)",deforestacion-en-reserva-de-la-biosfera-mariposa-monarca-mexico,
the-retreat-from-monsanto-bt-cotton-burkina-faso,Indian Peasant Farmers Resist Biodiversity Registers & GMO Cotton,indian-peasant-farmers-resist-biodiversity-registers-gmo-cotton,
dakota-access-pipeline,"Opposition to Keystone XL in Nebraska, United States",keystone-xl-in-nebraska,
dakota-access-pipeline,"Opposition to Keystone 1 Pipeline in South Dakota and huge oil leak, USA",210000-gallon-oil-spill-from-keystone-pipeline-in-south-dakota,
dakota-access-pipeline,"Louisiana's Bayou Bridge Pipeline Project, United States",no-bayou-bridge-pipeline-project,
dakota-access-pipeline,"Northern Access Pipeline, Pennsylvania and New York, USA",northern-access-pipeline,
dakota-access-pipeline,"Black Hills gold mining and land theft, South Dakota, USA",black-hills-land-theft,
mangrove-forest-destroyed-by-shell-in-the-niger-delta-nigeria,"Shell oil exploration and extraction, Nigeria",shell-nigeria,
south-korean-conglomerate-posco-daewoo-oil-palm-expansion-indonesia,"Merauke Integrated Food and Energy Estate (MIFEE), Papua, Indonesia ",mifee,
fainu-airport,"Lakshadweep islands residents complain against a “political-corporate” nexus, India",lakshadweep-residents-complain-india,
potosi-san-bartolome-estabilidad-geologica-del-cerro-rico-patrimonio-de-la-humanidad-bolivia,"Dique de colas de San Miguel, Cantumarca, Potosí, Bolivia",dique-de-colas-de-san-miguel,
pescadores-de-sechura-contra-exploracion-petrolera-peru,"Disputa por espacio marítimo entre industria petrolera y pesca, Sonda de Campeche, Mexico ",conflicto-en-la-industria-petrolera-y-la-pesca-en-la-sonda-de-campeche,
hazardous-garbage-dumping-and-new-waste-to-energy-projects-in-colombo-sri-lanka,"Aruwakkalu landfill, Puttalam, Sri Lanka",aruwakkalu-landfill-puttalam-sri-lanka,
disputas-de-los-indigenas-del-alto-paragua-en-torno-a-la-mineria-ilegal-en-sus-territorios,"Indígenas  warao (Delta del Orinoco) contaminados por Corporación Venezolana de Guayana y  minería ilegal, Venezuela ",indigenas-warao-en-el-bajo-delta-del-orinoco-contaminados-por-desechos-de-la-corporacion-venezolana-de-guayana-y-de-la-mineria-ilegal,
disputas-de-los-indigenas-del-alto-paragua-en-torno-a-la-mineria-ilegal-en-sus-territorios,"Indígenas yabarana, hoti y e’ñepa afectados por minería ilegal en Manapiare, Venezuela",indigenas-yabarana-hoti-y-enepa-afectados-por-mineria-ilegal-en-el-municipio-manapiare,
disputas-de-los-indigenas-del-alto-paragua-en-torno-a-la-mineria-ilegal-en-sus-territorios,"Las luchas contra el mega-proyecto del Arco Minero del Orinoco, Venezuela",las-luchas-contra-el-mega-proyecto-del-arco-minero-del-orinoco,
pocem-hydropower-dam-albania,Valbona River Hydropower Conflict,valbona-river-hydropower-conflict,
uzere-community-protest-against-shell-nigeria,"Shell oil exploration and extraction, Nigeria",shell-nigeria,
uzere-community-protest-against-shell-nigeria,"Shell Must Fall campaign, The Netherlands",shell-must-fall-campaign,
redd-conflicts-in-oddar-meanchey-community-forest-cambodia,"Katigan peatland conservation and REDD project excluding traditional owners, Kalimantan, Indonesia",katigan-peatland-conservation-excluding-traditional-owners-indonesia,
crisis-del-agua-en-la-zona-metropolitana-de-monterrey-mexico,"Acaparamiento de agua por parte de la embotelladora Topo Chico, filial de Coca Cola, en Monterrey, México",acaparamiento-de-agua-por-parte-de-femsa-coca-cola-en-topo-chico-mexico,
pak-beng-dam,"Pak Lay dam, Laos",pak-lay-dam,
controversy-over-planned-paraxylene-px-plant-expansion-in-pengzhou-sichuan-china,"Opposing paraxylene (PX) plant in the PetroChina 10 Million tons/year Refinery, Kunming, Yunnan, China ",opposing-paraxylene-px-plant-in-the-petrochina-10-million-tons-year-refinery-project-anning-kunming-yunnan-china,
expansion-de-andina-244-chile,"Refinería y fundición ENAMI-CODELCO en Zona de Sacrificio Ventanas, Chile",zona-de-sacrificio-ventanas-refineria-y-fundicion-enami-codelco,
death-of-inner-mongolian-herder-run-over-by-coal-truck-driver-led-to-conflicts-in-the-region-china,"Coal mine pollution led to conflicts in Abaga Banner, Xilin Gol League, China",coal-mine-pollution-led-to-conflicts-in-abaga-banner-xilin-gol-league-china,
eastern-economic-corridor,"High-speed train Bangkok- Nong Khai, Thailand",high-speed-train-bangkok-nakhon-ratchasima,
explotacion-petrolera-en-el-municipio-de-acacias-meta,"Extracción de petróleo en La Macarena, Meta, Colombia",la-macarena-meta-colombia,
hollongi-greenfield-airport-india,"Doloo Tea Workers against Greenfield Airport, Assam, India",doloo-tea-workers-against-greenfield-airport-assam,
hawaiians-protest-stopped-large-telescope-symbolizing-western-colonisation-on-the-mauna-kea-mountain-usa,"Native Hawaiians and Local Residents Protest Na Pua Makani Wind Project, Hawai'i, USA",indigenous-hawaiians-and-local-residents-protest-na-pua-makani-industrial-wind-farm,
conflicto-interprovincial-por-cuerpo-de-agua-rio-atuel,"Represa Portezuelo del Viento en Mendoza, Argentina",portezuelo-del-viento,
eko-atlantic-city-lagos-nigeria,"Demolition and evictions of Makoko's community, Nigeria",field-report-313-evicted-makoko-women-and-children-face-humanitarian-crises,
chevron-operations-meet-with-protests-australia,"Woodside's Burrup gas hub threatens ancient aboriginal sacred art, Western Australia",scarborough-gas-project,
lgv-bordeaux-spain-northern-basque-country-france,Bordeaux–Toulouse High Speed Rail,bordeaux-toulouse-high-speed-rail,
nagaragawa-dam,"Isahaya Bay, fill in of the tidal flats, Japan ",isahaya-bay-nagasaki-prefecture-construction-of-the-dyke-japan,
el-cerrejon-mine-colombia,"Glencore and Prodeco coal mining, Colombia",glencore-prodeco-colombia,
el-cerrejon-mine-colombia,"Represa El Cercado en el río Ranchería, La Guajira, Colombia",represa-rio-rancheria-la-guajira-colombia,
el-cerrejon-mine-colombia,"Comunidad Wayuu, Guajira, resistiendo la desviación del Arroyo Bruno por la empresa El Cerrejón, Colombia ",glencore-switzerland-bhp-billiton-united-kingdom-angloamerican-australia,
el-cerrejon-mine-colombia,"Indígenas wayúu del Socuy defienden sus territorios ante extracción de carbón y otros proyectos, Venezuela",indigenas-wayuu-del-socuy-defienden-sus-territorios-ante-el-avance-de-proyectos-vinculados-a-la-extraccion-de-carbon-carbozulia,
closure-and-modernisation-of-old-nickel-and-copper-smelter-monchegorsk-kola-peninsula-russia,"Protest against heavy pollution from Russian nickel plant in Kirkenes, Norway",protest-against-heavy-pollution-from-russian-nickel-plant-kirkenes-norway,
closure-and-modernisation-of-old-nickel-and-copper-smelter-monchegorsk-kola-peninsula-russia," Monchetundra nickel and palladium mining, Kola peninsula, Russia",moche-tundra-litium-ming-kola-peninsula-russia,
closure-and-modernisation-of-old-nickel-and-copper-smelter-monchegorsk-kola-peninsula-russia,"Kolmozero lithium mining, Kola peninsula, Russia",lithium-mining-kola-peninsula-russia,
closure-and-modernisation-of-old-nickel-and-copper-smelter-monchegorsk-kola-peninsula-russia,"Khibiny Mountains - Fyodorova Tundra platinum and palladium mining, Kola peninsula, Russia",khibiny-mountains-platinum-and-palladium-mining-kola-peninsula-russia,
flower-market-square-redevelopment-plan-zagreb-croatia,"Sport and Recreation Center 'Svetice' Zagreb, Croatia",sport-and-recreation-center-svetice-croatia,
contaminacion-por-relaves-mineros-en-el-rio-pilcomayo-bolivia,"Extracción de Gas y Petróleo en el Rio Pilcomayo, Bolivia",estraccion-de-gas-y-petroleo-en-el-lado-boliviano-del-rio-pilcomayo,
conflict-over-bears-ears-national-monument,"Dixie Meadows Geothermal Plant, Nevada, USA",dixie-meadows-geothermal-plant-nevada-usa,
projeto-cacapava-do-sul,"Eagle Fertilizers and phosphate mining, Lavras do Sul - RGS, Brazil",eagle-fertilizers-and-phosphate-mining-lavras-do-sul-rgs-brazil,
proyecto-hidroelectrico-la-miel-ii,"Pequeña Central Hidroeléctrica El Edén, Colombia",pequena-central-hidroelectrica-el-eden,
midcat-gas-pipeline,"Danish-Polish Baltic Pipe Fossil Gas Infrastructure Project, Denmark",danish-polish-baltic-pipe-fossil-gas-infrastructure-project-denmark,
concentrated-animal-feeding-operations-and-minority-residents-in-kenansville-north-carolina-usa,"Macrogranja (CAFO) para la producción lechera en Noviercas, Soria, Spain",granja-de-vacas-de-noviercas-soria-spain,
ntacua-tree-plantations-in-zambezia-mozambique,"Tectona monoculture tree plantations, Mozambique",tectona-monoculture-tree-plantations-mozambique,
sicogon-island-tourism-estate-philippines,"Local LGBTQI  struggles for post-disaster recovery turn into the Climate Change and Human Rights Inquiry against “Carbon Mayors”, The Philippines",post-disaster-typhoon-yolanda-recovery-process-fossil-fuels-climate-change-conflict,
sagay-massacre-of-sugar-farmers-philippines,"Escalante Massacre over sugar plantations, Negros Occidental, the Philippines",escalante-massacre-of-agrarian-activists-negros-occidental-philippines,
sagay-massacre-of-sugar-farmers-philippines,"Kidapawan massacre  in 2016 over hungry farmers protest, North Cotabato, the Philippines",kidapawan-massacre,
sagay-massacre-of-sugar-farmers-philippines,"Negros Massacre: Murder of 14 farmers in Negros, The Philippines",negros-massacre-murder-of-14-farmers-in-negros-the-philippines,
rio-tintos-iron-mine-and-destruction-of-sacred-aboriginal-sites-australia,"Woodside's Burrup gas hub threatens ancient aboriginal sacred art, Western Australia",scarborough-gas-project,
garbage-mountain-saida,"Costa Brava Landfill, Lebanon",costa-brava-landfill-lebanon,
garbage-mountain-saida,ACKEJ_SHANE Second Lebanon War,second-lebanon-war,
nickel-ore-exploration-mining-trstenik-serbia,"Nickel ore exploration in Mokra Gora region, Serbia",intentions-of-exploration-of-nickel-ore-in-mokra-gora-serbia,
deva-muncel-gold-polymetallic-ores-exploitation,"Certej gold mining, Romania",certej-gold-mining-romania,
deva-muncel-gold-polymetallic-ores-exploitation,"Gold and polymetallic ores mining in Brad and the battle against cyanide, Romania",brad-polymetallic-ores-including-gold,
afectadas-por-el-nemagon-costa-rica,"Afectados por el Nemagón, Honduras ",afectados-por-el-nemagon-honduras,
afectadas-por-el-nemagon-costa-rica," DBCP and male infertility in Lathrop, California, United States",dbcp-and-male-infertility-in-lathrop-california,
afectadas-por-el-nemagon-costa-rica,"Farmworkers poisoned by DBCP (Nemagon), Philippines",philippine-farmworkers-poisoned-by-dbcp-pesticide,
afectadas-por-el-nemagon-costa-rica,"Banana workers affected by  agrotoxics in Barú, Panamá",banana-workers-affected-by-fumazo-dbcp-in-baru-panama,
afectadas-por-el-nemagon-costa-rica,"DBCP Poisoned Water Wells in Hawaii, US",pineapples-lasting-legacy-the-poisoned-wells-by-dbcp-in-hawaii,
holcim-cement-plant-in-puttalam,"Aruwakkalu landfill, Puttalam, Sri Lanka",aruwakkalu-landfill-puttalam-sri-lanka,
holcim-cement-plant-in-puttalam,La Fundación  Apaxtle y Prosalud Apaxco-Atotonilco contra planta Ecoltec de Holcim. Mexico.,fundacion-para-el-desarrollo-integral-apaxtle-ac-y-prosalud-apaxco-atotonilco-contra-planta-ecoltec-de-cementera-holcim-2009-apaxco-edomex-y-atotonilco-de-tula-hidalgo,
holcim-cement-plant-in-puttalam,Complaints against Holcim-Lafarge quarries and cement factories in France and Switzerland,holcim-lafarge-quarry-switzerland,
attempted-conversion-of-reserve-forests-for-housing-of-public-officials-coxs-bazar-district-bangladesh,Urbanization,urbanization,
waste-incinerator-in-resnik-zagreb-croatia,"Regional Landfill Lećevica, Croatia",regional-landfill-lecevica-croatia,
huichapan-waste-incineration-in-cemex-factory-hidalgo,"Atotonilco de Tula y la planta de Cemex, Mexico",atotonilco-de-tula-vs-incineracion-de-residuos-solidos-urbanos-en-la-planta-de-cemex-atotonilco,
huichapan-waste-incineration-in-cemex-factory-hidalgo,"Contaminación del río Tula en Hidalgo, México",contaminacion-del-rio-tula,
huichapan-waste-incineration-in-cemex-factory-hidalgo,La Fundación  Apaxtle y Prosalud Apaxco-Atotonilco contra planta Ecoltec de Holcim. Mexico.,fundacion-para-el-desarrollo-integral-apaxtle-ac-y-prosalud-apaxco-atotonilco-contra-planta-ecoltec-de-cementera-holcim-2009-apaxco-edomex-y-atotonilco-de-tula-hidalgo,
savepulangiriver-philippines,"Logging in San Fernando, Mindanao, the Philippines",logging-in-san-fernando-mindanao-the-philippines,
ashaninka-rioamonia-saweto-againstlogging-acre-brazil,"Ashaninka community against Tawaya biopiracy, Acre, Brazil",ashaninka-community-against-tawaya-cosmeticos,
ashaninka-rioamonia-saweto-againstlogging-acre-brazil,"Petrobras oil exploration and illegal logging in Murunahua indigenous reserve, Ucayali, Peru",petribras-oil-exploration-and-illegal-logging-in-murunahua-indigenous-reserve-ucayali-peru,
ashaninka-rioamonia-saweto-againstlogging-acre-brazil,"Killing of Asháninka leader Estela Casanto Mauricio in Junín, Peru",killing-of-ashaninka-leader-estela-casanto-mauricio-in-junin-peru,
protest-against-chinese-companies-to-build-elevated-railways-hinder-animal-migrationnairobi-kenya,"Offshore sea sand harvest in Kwale district, south of Mombasa, Kenya",offshore-sea-sand-harvest-from-in-south-coast-of-the-indian-ocean-kenya,
hidroelectricas-de-atzala-coyolapa-puebla-mexico,"Hidroelectrica Gaya en el rio Apulco, Puebla, Mexico",gaya-hidroelectrica-rioapulco-puebla,
hidroelectricas-de-atzala-coyolapa-puebla-mexico,"Línea de Alta Tensión y subestación eléctrica en Cuetzalan, Puebla, México",linea-de-alta-tension-lat-cuetzalan-entronque-teziutlan-ii-tajin-y-subestacion-de-energia-electrica-de-la-comision-federal-de-electricidad-cfe,
controversy-over-planned-paraxylene-px-plant-in-xiamen-fujian-china,"Controversy over planned paraxylene (PX) plant construction in Jiujiang, Jiangxi, China",controversy-over-planned-paraxylene-px-plant-expansion-in-jiujiang-jiangxi-china,
controversy-over-planned-paraxylene-px-plant-in-xiamen-fujian-china,"Opposition to PX plant in Zhangzhou and explosion accidents, Fujian, China",explosions-at-paraxylene-px-petchem-plant-and-the-related-protests-zhangzhou-fujian,
prestige-oil-spill-in-galician-coast-spain,"Iranian tanker disaster and oil spill in East China Sea, China",oil-spill-of-east-china-sea-in-2018china,
prestige-oil-spill-in-galician-coast-spain,"ERIKA Shipwreck and Oil Spill , Britanny, France",erika-shipwreck-and-oil-spill-britanny-france,
prestige-oil-spill-in-galician-coast-spain,"Oil leak is threatening nature and local people's health, Mauritius",oil-leak-in-mauritus-islands-is-threatenind-nature-and-local-peoples-health,
prestige-oil-spill-in-galician-coast-spain,"The “black tide” of the Torrey Canyon oil spill, UK",torrey-canyon-oil-spill-uk,
prestige-oil-spill-in-galician-coast-spain,"Amoco Cadiz oil spill in 1978 in Britanny, France. ",amoco-cadiz-oil-spill-in-1978-britanny-france,
prestige-oil-spill-in-galician-coast-spain,"The Sea Empress oil spill, Pembrokeshire, Wales, UK",sea-empress-oil-spill-uk,
c-excessive-blood-lead-of-workers-of-ricun-battery-technology-in-changzhou-jiangsu-china,"Lead acid batteries recycling factory in Mombasa, Kenya",lead-smelting-factory-mombassa-kenya,
ringland-vs-bam-belgium,"‘Pak ze aan, de Turnhoutsebaan’ - cyclists' safety in a less car-centric Antwerp, Belgium",pak-ze-aan-de-turnhoutsebaan-the-demand-for-a-less-car-centric-mobility-policy-in-antwerp,
deforestacion-de-manglar-san-blas-nayarit-mexico,"Malecón Tajamar-Cancún destruye Manglar en Quintana Roo, Mexico ",malecon-tajamar-cancun-destruye-manglar-en-quintana-roo-mexico,
shell-petrochemical-plant-and-pollution-in-norco-us,"Mobilizing against Environmental Injustices Post-Katrina: New Orleans East, Louisiana, US",mobilizing-against-environmental-injustices-post-katrina-new-orleans-east-louisiana-us,
high-speed-train-basque-country-spain,"Navarrese Corridor High Speed Rail, Spain",navarrese-corridor-high-speed-rail,
papagayos-mendoza-argentina,"Ninus and María Inés, Mendoza, Argentina",ninus-y-maria-ines-mendoza-argentina,
papagayos-mendoza-argentina,"Fracking de petróleo en Mendoza, Argentina",fracking-for-oil-in-mendoza-argentina,
linginte-mining-and-the-ende-gelande-movement,"Ffos-y-fran opencast coal mine, South Wales, United Kingdom",ffos-y-fran-opencast-coal-mine-south-wales,
