name,slug,relations
"Garifuna resistance in Vallecito against land grabbing for palm oil plantations and drug trade, Honduras",oil-palm-plantations-in-the-bajo-aguan-honduras,
"Environmental liabilities (pasivos ambientales) of Minera San Acacio, Vetagrande, Zacatecas, Mexico",minera-real-de-angeles-zacatecas,
"Excessive forest logging, Lithuania",bialowieza-forest,
"Excessive logging in Carpathian Forest, Poland",bialowieza-forest,
"Mong Ton (or Tasang) Dam, Myanmar",hatgyi-dam-myanmar,
"Naung Pha dam on the Salween River, Shan State Myanmar",hatgyi-dam-myanmar,
"Kunlong (or Upper Thanlwin) dam on the Salween River, Myanmar",hatgyi-dam-myanmar,
"Ywathit dam on the Salween River, Karenni state, Myanmar",hatgyi-dam-myanmar,
"Weigyi dam on the Salween River, Karen and Karenni state, Myanmar",hatgyi-dam-myanmar,
"Nuclear power station in Tihange, Belgium",nuclear-power-station-in-doel,
"Shell oil exploration and extraction, Nigeria",oil-spill-at-ojobo-community-nigeria,
"Exploratory Fracking at Kirby Misperton, Yorkshire, UK",preston-new-road-fracking-site-aka-little-plumptons,
"Minera Aruntani-Arasi y contaminación de ríos en Puno, Peru",contaminacion-de-rio-por-proyecto-minero-el-cofre-peru,
"Ywathit dam on the Salween River, Karenni state, Myanmar",kun-long-dam-on-the-salween-river-myanmar,
"Weigyi dam on the Salween River, Karen and Karenni state, Myanmar",kun-long-dam-on-the-salween-river-myanmar,
"Coal mining fires and many other conflicts in coal fields of Dhanbad, Jharkhand, India",jharia-coalfield-fire-india,
"Erdeven Nuclear Power Plant, France",cattenom-nuclear-reactor-france,
"Dirty and dangerous shipbreaking in Gadani, Pakistan",dirty-and-dangerous-shipbreaking-in-alang,
" Lungmen Nuclear Power Plant (“Nuke 4”) stopped, Taiwan",kuokuang-petrochemical-technology-company-taiwan,
"Mobilizing against Environmental Injustices Post-Katrina: New Orleans East, Louisiana, US",shintech-pvc-plant-in-the-cancer-alley-usa,
" Baiga women’s mobilization to protect forests from Forest Department intervention in Pondi, India",forest-rights-of-indigenous-people-in-junwani-village,
"Waste treatment plant in Sacabamba, Cochabamba, Bolivia",contaminacion-por-el-botadero-kara-kara-bolivia,
"Construcción de una variante a la Carretera CV311 en Valencia, Spain",port-expansion-in-la-punta-valencia-spain,
" Thermal Power Plant Tuzla, Bosnia and Herzegovina",thermal-power-plant-stanari,
"Illegal exploitation of tropical wood by Norsudtimber, in DR Congo",feronia-inc,
"Shrimp Cultivation destroying local livelihood, Bangladesh",successful-protests-to-remain-a-shrimp-free-zone-in-polder-22-bangladesh,
"Killing of Asháninka leader Estela Casanto Mauricio in Junín, Peru",ashaninka-community-against-tawaya-cosmeticos,
"Línea de Alta Tensión y subestación eléctrica en Cuetzalan, Puebla, México",ixtacamaxtitlan-proyectosmineros-almaden,
"Minería ilegal y la contaminación por mercurio en El Callao, Venezuela",afectacion-de-los-pueblos-yekwana-y-sanema-por-mineria-ilegal-en-el-rio-caura,
"La fiebre del coltán amenaza a indígenas guajibo, piaroa y e’ñepa en Bolívar y Amazonas, Venezuela",afectacion-de-los-pueblos-yekwana-y-sanema-por-mineria-ilegal-en-el-rio-caura,
"Comunidades yanomami de la cuenca del río Ocamo afectadas por minería ilegal, Venezuela",afectacion-de-los-pueblos-yekwana-y-sanema-por-mineria-ilegal-en-el-rio-caura,
"Disputas de los indígenas del Alto Paragua en torno a la minería ilegal en sus territorios, Venezuela  ",afectacion-de-los-pueblos-yekwana-y-sanema-por-mineria-ilegal-en-el-rio-caura,
"Indígenas  warao (Delta del Orinoco) contaminados por Corporación Venezolana de Guayana y  minería ilegal, Venezuela ",afectacion-de-los-pueblos-yekwana-y-sanema-por-mineria-ilegal-en-el-rio-caura,
"Indígenas yabarana, hoti y e’ñepa afectados por minería ilegal en Manapiare, Venezuela",afectacion-de-los-pueblos-yekwana-y-sanema-por-mineria-ilegal-en-el-rio-caura,
"Pueblos indígenas arawaks del sur afectados por minería ilegal en la cuenca del río Atabapo, Venezuela",afectacion-de-los-pueblos-yekwana-y-sanema-por-mineria-ilegal-en-el-rio-caura,
"Las luchas contra el mega-proyecto del Arco Minero del Orinoco, Venezuela",afectacion-de-los-pueblos-yekwana-y-sanema-por-mineria-ilegal-en-el-rio-caura,
"Minera Aruntani-Arasi y contaminación de ríos en Puno, Peru",torata,
"ASU_Corporación Ananea, La Rinconada",torata,
"Shell oil exploration and extraction, Nigeria",multiple-spills-in-biseni-nigeria,
"Josemaria proyecto minería, San Juan, Argentina",famatina-gold-mining-argentina,
"Brahmapuram Solid Waste Processing Plant, Kerala, India",vilappilsala-waste-plant-vilappilsala-kerala-india,
"Cerro Blanco, Guatemala",marlin-guatemala,
"Proyecto Minero El Escobal, Guatemala",marlin-guatemala,
"Proyecto Minero Los Chocoyos en Sipakapa, Guatemala",marlin-guatemala,
"Resistencia de los Maya Mam contra proyectos de minería en Huehuetenango, Guatemala ",hidralia-guatemala,
"Hydropower plants in Yich Ki'sis,  San Mateo Ixtatán, Guatemala",hidralia-guatemala,
"Río Atoyac (Tlaxcala-Puebla), infierno ambiental. Mexico ",contamination-in-el-salto-mexico,
"Sinop Nuclear Power Plant, Turkey",akkuyu-nuclear-power-plant-turkey,
"Radioactive contamination from an old uranium mine, Köprübaşı province, Turkey",akkuyu-nuclear-power-plant-turkey,
"Bikita Minerals Lithium mine impacts local communities and brings corruption in the Masvingo Province, Zimbabwe ",marange-diamond-land-and-human-rights-abuses-zimbabwe,
"Bikita Minerals Lithium mine in the Masvingo Province, Zimbabwe",marange-diamond-land-and-human-rights-abuses-zimbabwe,
"Mong Kok (Mai Khot) coal mine and power station, Shan State, Myanmar",mong-kung-coal-mine-shan-state-myanmar,
"Phosphorite mining, Estonia",estonias-shale-oi-estonia,
"Excess Air Pollution in Chelsea City, Massachusetts",east-eagle-reliability-project-in-east-boston-by-eversource,
"Fracking de petróleo en Mendoza, Argentina",general-alvear-suspende-proyecto-de-exeter-mendoza-argentina,
Ashaninka of Rio Amônia and Saweto against illegal loggers at border Peru-Brazil,carreteras-en-purus-inapari,
"Interoceánica as a driver of deforestation and land use change in Madre de Dios, Peru",carreteras-en-purus-inapari,
"Kangaluwi Copper Mine in the Lower Zambezi National Park, Zambia",vedanta-and-konkola-zambia,
"Megaproyecto energético Proyecto Integral Morelos, México",alamosgold-morelos-mexico,
"Iñupiat people resist offshore oil drilling and gas development plans in Point Hope, Alaska, USA",shells-drilling-for-oil-in-the-arctic,
"Deforestation by Grupo Romero in Amazonia with oil palm plantations, Peru",deforestacion-en-loreto-y-ucayali-por-grupo-melka,
"Santa Clara de Uchunya against palm oil plantation, Peru",deforestacion-en-loreto-y-ucayali-por-grupo-melka,
"Hidrovía amazónica, Ucayali, Peru",deforestacion-en-loreto-y-ucayali-por-grupo-melka,
"Kanyika Niobium Project, Malawi",mulanje-massif-rare-earth-mineral-exploration-malawi,
"Conga mining project, Peru",yanacocha-mine-peru,
"Newmont's Ahafo gold mine, Ghana",yanacocha-mine-peru,
"Hidroeléctrica El Naranjal, Veracruz,  Mexico",proyecto-hidroelectrico-veracruz-mexico,
"Nickel rush threatens the health and environment of Obi Island's people, Indonesia",islanders-resisting-nickel-mining-permits-wawonii-southeast-sulawesi-indonesia,
"Indonesia Morowali Industrial Park (IMIP), Central Sulawesi, Indonesia",islanders-resisting-nickel-mining-permits-wawonii-southeast-sulawesi-indonesia,
"Delong Nickel Industrial Area, Sulawesi,  Indonesia",islanders-resisting-nickel-mining-permits-wawonii-southeast-sulawesi-indonesia,
"Xiangjiaba Hydropower Plant in Yunnan and Sichuan, southwest China",controversy-over-construction-of-the-xiaonanhai-dam-along-the-yangtze-river-in-chongqing-china,
"The A45 motorway, Lyon, France",motorway-to-bypass-strasbourg,
"Destruction of the Aubervilliers Workers' Gardens, France",motorway-to-bypass-strasbourg,
"La Réunion New Coastal Road, France",motorway-to-bypass-strasbourg,
"Erdeven Nuclear Power Plant, France",chooz-nuclear-power-plant-meuse-river-france,
" Muelle de Pie de la Cuesta y muerte de Fabiola Osorio por defender el manglar, Guerrero, Mexico",ocespcc-campesinos-ecologistas-de-guerrero-mexico,
"Mining in indigenous territories and the RENCA Amazon reserve, Amapá - Pará, Brazil",indigenous-communities-of-rio-negro-divided-over-mining-regularization-and-affected-by-commercial-cooptation-and-illegal-mining,
"Illegal gold mining and poaching in Vale do Javari Indigenous Territory, Amazonas, Brazil",indigenous-communities-of-rio-negro-divided-over-mining-regularization-and-affected-by-commercial-cooptation-and-illegal-mining,
"Road construction through TI Waimiri Atroari, Amazonas - Roraima, Brazil",extension-of-tucurui-transmission-line-to-roraima-brazil,
"Balbina Hydroelectric Dam, Amazonas, Brazil",extension-of-tucurui-transmission-line-to-roraima-brazil,
"Illegal logging threatens isolated Pirititi indigenous group, Roraima, Brazil",extension-of-tucurui-transmission-line-to-roraima-brazil,
"Standard Gauge Railway Project Phase 2A Nairobi-Naivasha, Kenya ",standard-gauge-railway-project-from-mombasa-to-nairobi-kenya,
"Offshore sea sand harvest in Kwale district, south of Mombasa, Kenya",standard-gauge-railway-project-from-mombasa-to-nairobi-kenya,
"Illegal logging threatens isolated Pirititi indigenous group, Roraima, Brazil",balbina-hydroelectric-dam-amazonas-brazil,
"Derrame de ácido sulfúrico de Grupo México en el mar de Cortés, Sonora, México",toxic-spill-from-mining-company-belonging-to-grupo-mexico-sonora-mexico,
"Newtown Creek: Disproportionate Effects of Oil Spills on Communities In Brooklyn and Queens, New York, USA ",national-grid-pipeline-in-north-brooklyn,
"Nuclear power plant in Le Carnet, France ",golfech-nuclear-power-plant-france,
"Defensa del bosque cobra la vida de líderes ejidatarios Homero Gómez y Raúl Hernández. Reserva de la Biosfera Mariposa Monarca, Michoacán (México)",angangueo-community-vs-grupo-mexico-michoacan,
Indian Peasant Farmers Resist Biodiversity Registers & GMO Cotton,the-retreat-from-monsanto-bt-cotton-burkina-faso,
"Opposition to Keystone XL in Nebraska, United States",dakota-access-pipeline,
"Opposition to Keystone 1 Pipeline in South Dakota and huge oil leak, USA",dakota-access-pipeline,
"Louisiana's Bayou Bridge Pipeline Project, United States",dakota-access-pipeline,
"Northern Access Pipeline, Pennsylvania and New York, USA",dakota-access-pipeline,
"Black Hills gold mining and land theft, South Dakota, USA",dakota-access-pipeline,
"Shell oil exploration and extraction, Nigeria",mangrove-forest-destroyed-by-shell-in-the-niger-delta-nigeria,
"Merauke Integrated Food and Energy Estate (MIFEE), Papua, Indonesia ",south-korean-conglomerate-posco-daewoo-oil-palm-expansion-indonesia,
"Lakshadweep islands residents complain against a “political-corporate” nexus, India",fainu-airport,
"Dique de colas de San Miguel, Cantumarca, Potosí, Bolivia",potosi-san-bartolome-estabilidad-geologica-del-cerro-rico-patrimonio-de-la-humanidad-bolivia,
"Disputa por espacio marítimo entre industria petrolera y pesca, Sonda de Campeche, Mexico ",pescadores-de-sechura-contra-exploracion-petrolera-peru,
"Aruwakkalu landfill, Puttalam, Sri Lanka",hazardous-garbage-dumping-and-new-waste-to-energy-projects-in-colombo-sri-lanka,
"Indígenas  warao (Delta del Orinoco) contaminados por Corporación Venezolana de Guayana y  minería ilegal, Venezuela ",disputas-de-los-indigenas-del-alto-paragua-en-torno-a-la-mineria-ilegal-en-sus-territorios,
"Indígenas yabarana, hoti y e’ñepa afectados por minería ilegal en Manapiare, Venezuela",disputas-de-los-indigenas-del-alto-paragua-en-torno-a-la-mineria-ilegal-en-sus-territorios,
"Las luchas contra el mega-proyecto del Arco Minero del Orinoco, Venezuela",disputas-de-los-indigenas-del-alto-paragua-en-torno-a-la-mineria-ilegal-en-sus-territorios,
Valbona River Hydropower Conflict,pocem-hydropower-dam-albania,
"Shell oil exploration and extraction, Nigeria",uzere-community-protest-against-shell-nigeria,
"Shell Must Fall campaign, The Netherlands",uzere-community-protest-against-shell-nigeria,
"Katigan peatland conservation and REDD project excluding traditional owners, Kalimantan, Indonesia",redd-conflicts-in-oddar-meanchey-community-forest-cambodia,
"Acaparamiento de agua por parte de la embotelladora Topo Chico, filial de Coca Cola, en Monterrey, México",crisis-del-agua-en-la-zona-metropolitana-de-monterrey-mexico,
"Pak Lay dam, Laos",pak-beng-dam,
"Opposing paraxylene (PX) plant in the PetroChina 10 Million tons/year Refinery, Kunming, Yunnan, China ",controversy-over-planned-paraxylene-px-plant-expansion-in-pengzhou-sichuan-china,
"Refinería y fundición ENAMI-CODELCO en Zona de Sacrificio Ventanas, Chile",expansion-de-andina-244-chile,
"Coal mine pollution led to conflicts in Abaga Banner, Xilin Gol League, China",death-of-inner-mongolian-herder-run-over-by-coal-truck-driver-led-to-conflicts-in-the-region-china,
"High-speed train Bangkok- Nong Khai, Thailand",eastern-economic-corridor,
"Extracción de petróleo en La Macarena, Meta, Colombia",explotacion-petrolera-en-el-municipio-de-acacias-meta,
"Doloo Tea Workers against Greenfield Airport, Assam, India",hollongi-greenfield-airport-india,
"Native Hawaiians and Local Residents Protest Na Pua Makani Wind Project, Hawai'i, USA",hawaiians-protest-stopped-large-telescope-symbolizing-western-colonisation-on-the-mauna-kea-mountain-usa,
"Represa Portezuelo del Viento en Mendoza, Argentina",conflicto-interprovincial-por-cuerpo-de-agua-rio-atuel,
"Demolition and evictions of Makoko's community, Nigeria",eko-atlantic-city-lagos-nigeria,
"Woodside's Burrup gas hub threatens ancient aboriginal sacred art, Western Australia",chevron-operations-meet-with-protests-australia,
Bordeaux–Toulouse High Speed Rail,lgv-bordeaux-spain-northern-basque-country-france,
"Isahaya Bay, fill in of the tidal flats, Japan ",nagaragawa-dam,
"Glencore and Prodeco coal mining, Colombia",el-cerrejon-mine-colombia,
"Represa El Cercado en el río Ranchería, La Guajira, Colombia",el-cerrejon-mine-colombia,
"Comunidad Wayuu, Guajira, resistiendo la desviación del Arroyo Bruno por la empresa El Cerrejón, Colombia ",el-cerrejon-mine-colombia,
"Indígenas wayúu del Socuy defienden sus territorios ante extracción de carbón y otros proyectos, Venezuela",el-cerrejon-mine-colombia,
"Protest against heavy pollution from Russian nickel plant in Kirkenes, Norway",closure-and-modernisation-of-old-nickel-and-copper-smelter-monchegorsk-kola-peninsula-russia,
" Monchetundra nickel and palladium mining, Kola peninsula, Russia",closure-and-modernisation-of-old-nickel-and-copper-smelter-monchegorsk-kola-peninsula-russia,
"Kolmozero lithium mining, Kola peninsula, Russia",closure-and-modernisation-of-old-nickel-and-copper-smelter-monchegorsk-kola-peninsula-russia,
"Khibiny Mountains - Fyodorova Tundra platinum and palladium mining, Kola peninsula, Russia",closure-and-modernisation-of-old-nickel-and-copper-smelter-monchegorsk-kola-peninsula-russia,
"Sport and Recreation Center 'Svetice' Zagreb, Croatia",flower-market-square-redevelopment-plan-zagreb-croatia,
"Extracción de Gas y Petróleo en el Rio Pilcomayo, Bolivia",contaminacion-por-relaves-mineros-en-el-rio-pilcomayo-bolivia,
"Dixie Meadows Geothermal Plant, Nevada, USA",conflict-over-bears-ears-national-monument,
"Eagle Fertilizers and phosphate mining, Lavras do Sul - RGS, Brazil",projeto-cacapava-do-sul,
"Pequeña Central Hidroeléctrica El Edén, Colombia",proyecto-hidroelectrico-la-miel-ii,
"Danish-Polish Baltic Pipe Fossil Gas Infrastructure Project, Denmark",midcat-gas-pipeline,
"Macrogranja (CAFO) para la producción lechera en Noviercas, Soria, Spain",concentrated-animal-feeding-operations-and-minority-residents-in-kenansville-north-carolina-usa,
"Tectona monoculture tree plantations, Mozambique",ntacua-tree-plantations-in-zambezia-mozambique,
"Local LGBTQI  struggles for post-disaster recovery turn into the Climate Change and Human Rights Inquiry against “Carbon Mayors”, The Philippines",sicogon-island-tourism-estate-philippines,
"Escalante Massacre over sugar plantations, Negros Occidental, the Philippines",sagay-massacre-of-sugar-farmers-philippines,
"Kidapawan massacre  in 2016 over hungry farmers protest, North Cotabato, the Philippines",sagay-massacre-of-sugar-farmers-philippines,
"Negros Massacre: Murder of 14 farmers in Negros, The Philippines",sagay-massacre-of-sugar-farmers-philippines,
"Woodside's Burrup gas hub threatens ancient aboriginal sacred art, Western Australia",rio-tintos-iron-mine-and-destruction-of-sacred-aboriginal-sites-australia,
"Costa Brava Landfill, Lebanon",garbage-mountain-saida,
ACKEJ_SHANE Second Lebanon War,garbage-mountain-saida,
"Nickel ore exploration in Mokra Gora region, Serbia",nickel-ore-exploration-mining-trstenik-serbia,
"Certej gold mining, Romania",deva-muncel-gold-polymetallic-ores-exploitation,
"Gold and polymetallic ores mining in Brad and the battle against cyanide, Romania",deva-muncel-gold-polymetallic-ores-exploitation,
"Afectados por el Nemagón, Honduras ",afectadas-por-el-nemagon-costa-rica,
" DBCP and male infertility in Lathrop, California, United States",afectadas-por-el-nemagon-costa-rica,
"Farmworkers poisoned by DBCP (Nemagon), Philippines",afectadas-por-el-nemagon-costa-rica,
"Banana workers affected by  agrotoxics in Barú, Panamá",afectadas-por-el-nemagon-costa-rica,
"DBCP Poisoned Water Wells in Hawaii, US",afectadas-por-el-nemagon-costa-rica,
"Aruwakkalu landfill, Puttalam, Sri Lanka",holcim-cement-plant-in-puttalam,
La Fundación  Apaxtle y Prosalud Apaxco-Atotonilco contra planta Ecoltec de Holcim. Mexico.,holcim-cement-plant-in-puttalam,
Complaints against Holcim-Lafarge quarries and cement factories in France and Switzerland,holcim-cement-plant-in-puttalam,
Urbanization,attempted-conversion-of-reserve-forests-for-housing-of-public-officials-coxs-bazar-district-bangladesh,
"Regional Landfill Lećevica, Croatia",waste-incinerator-in-resnik-zagreb-croatia,
"Atotonilco de Tula y la planta de Cemex, Mexico",huichapan-waste-incineration-in-cemex-factory-hidalgo,
"Contaminación del río Tula en Hidalgo, México",huichapan-waste-incineration-in-cemex-factory-hidalgo,
La Fundación  Apaxtle y Prosalud Apaxco-Atotonilco contra planta Ecoltec de Holcim. Mexico.,huichapan-waste-incineration-in-cemex-factory-hidalgo,
"Logging in San Fernando, Mindanao, the Philippines",savepulangiriver-philippines,
"Ashaninka community against Tawaya biopiracy, Acre, Brazil",ashaninka-rioamonia-saweto-againstlogging-acre-brazil,
"Petrobras oil exploration and illegal logging in Murunahua indigenous reserve, Ucayali, Peru",ashaninka-rioamonia-saweto-againstlogging-acre-brazil,
"Killing of Asháninka leader Estela Casanto Mauricio in Junín, Peru",ashaninka-rioamonia-saweto-againstlogging-acre-brazil,
"Offshore sea sand harvest in Kwale district, south of Mombasa, Kenya",protest-against-chinese-companies-to-build-elevated-railways-hinder-animal-migrationnairobi-kenya,
"Hidroelectrica Gaya en el rio Apulco, Puebla, Mexico",hidroelectricas-de-atzala-coyolapa-puebla-mexico,
"Línea de Alta Tensión y subestación eléctrica en Cuetzalan, Puebla, México",hidroelectricas-de-atzala-coyolapa-puebla-mexico,
"Controversy over planned paraxylene (PX) plant construction in Jiujiang, Jiangxi, China",controversy-over-planned-paraxylene-px-plant-in-xiamen-fujian-china,
"Opposition to PX plant in Zhangzhou and explosion accidents, Fujian, China",controversy-over-planned-paraxylene-px-plant-in-xiamen-fujian-china,
"Iranian tanker disaster and oil spill in East China Sea, China",prestige-oil-spill-in-galician-coast-spain,
"ERIKA Shipwreck and Oil Spill , Britanny, France",prestige-oil-spill-in-galician-coast-spain,
"Oil leak is threatening nature and local people's health, Mauritius",prestige-oil-spill-in-galician-coast-spain,
"The “black tide” of the Torrey Canyon oil spill, UK",prestige-oil-spill-in-galician-coast-spain,
"Amoco Cadiz oil spill in 1978 in Britanny, France. ",prestige-oil-spill-in-galician-coast-spain,
"The Sea Empress oil spill, Pembrokeshire, Wales, UK",prestige-oil-spill-in-galician-coast-spain,
"Lead acid batteries recycling factory in Mombasa, Kenya",c-excessive-blood-lead-of-workers-of-ricun-battery-technology-in-changzhou-jiangsu-china,
"‘Pak ze aan, de Turnhoutsebaan’ - cyclists' safety in a less car-centric Antwerp, Belgium",ringland-vs-bam-belgium,
"Malecón Tajamar-Cancún destruye Manglar en Quintana Roo, Mexico ",deforestacion-de-manglar-san-blas-nayarit-mexico,
"Mobilizing against Environmental Injustices Post-Katrina: New Orleans East, Louisiana, US",shell-petrochemical-plant-and-pollution-in-norco-us,
"Navarrese Corridor High Speed Rail, Spain",high-speed-train-basque-country-spain,
"Ninus and María Inés, Mendoza, Argentina",papagayos-mendoza-argentina,
"Fracking de petróleo en Mendoza, Argentina",papagayos-mendoza-argentina,
"Ffos-y-fran opencast coal mine, South Wales, United Kingdom",linginte-mining-and-the-ende-gelande-movement,
"Coal Power Plant Karlsruhe, Germany",linginte-mining-and-the-ende-gelande-movement,
"Brunsbüttel LNG Terminal, Germany",linginte-mining-and-the-ende-gelande-movement,
"Dangjin Coal-Fired Power Complex, South Korea",yeongheung-coal-plant-south-korea,
"Nishiyodogawa in Osaka, air pollution court cases, Japan",yokkaichi-asthma-japan,
"Suape Port Industrial Complex and degradation of fisherfolks' subsistence, Brazil",complexo-industrial-portuario-de-suape-cips-pernambuco-brazil,
"Holcim cement plant in Puttalam, Sri Lanka",holcim-incineracion-y-desechos-solidos-el-salvador,
La Fundación  Apaxtle y Prosalud Apaxco-Atotonilco contra planta Ecoltec de Holcim. Mexico.,holcim-incineracion-y-desechos-solidos-el-salvador,
Complaints against Holcim-Lafarge quarries and cement factories in France and Switzerland,holcim-incineracion-y-desechos-solidos-el-salvador,
"Parque Eólico Chicxulub en ejido de Ixil, Yucatan, Mexico",tikul-a-y-b,
"Parque Fotovoltaico Yucatán Solar, Valladolid, México",tikul-a-y-b,
"Waste-to-Energy and Ghazipur landfill closure threaten livelihoods of informal recyclers, Delhi, India",sultanpur-dabas-village-landfall-site-delhi-india,
"Coal-Fired Power Plant in Luna, La Union, Luzon, Philippines",coal-fired-power-plant-batangas-philippines,
"Cancellation of Korean 2nd coal plant in Sual, Pangasinan, Luzon, Philippines",coal-fired-power-plant-batangas-philippines,
"Fishmeal Pollution in Chimbote, Peru",salango-comuna-against-pesquera-la-polar-ecuador,
"Logging blockade in Aalistunturi, Arctic, Finland",saami-metsahallitus-forest-conflict-inari-finland,
"Waste-to-Energy and Ghazipur landfill closure threaten livelihoods of informal recyclers, Delhi, India",landfill-site-at-maidan-garhi-new-delhi-india,
"Land and livelihood conflicts in Bhitarkanika Wildlife Sanctuary and mangrove forest , Odisha, India",fisherfolks-of-chilika-lake-odisha-india,
" Coal power plant to be built by Jiuquan Iron & Steel for alumina production at Nain, St Elizabeth , Jamaica",bauxite-mining-in-cockpit-country-jamaica,
"Skåne mining project, Sweden ",shell-shale-gas-project-skane-sweden,
"Maidan gold mine, Batken district, Kyrgyzstan",taldy-bulak-levoberezhny-gold-deposit-altynken-llc,
"Zhetim-Too mine in Naryn region, Kyrgystan",taldy-bulak-levoberezhny-gold-deposit-altynken-llc,
"Rio Blanco, Molleturo, Azuay, Ecuador",rio-tinto-zinc-in-molleturo-ecuador,
"Línea de Alta Tensión y subestación eléctrica en Cuetzalan, Puebla, México",gaya-hidroelectrica-rioapulco-puebla,
"Struggles against in situ leach uranium mining, Black Hills, South Dakota, USA",210000-gallon-oil-spill-from-keystone-pipeline-in-south-dakota,
"Black Hills gold mining and land theft, South Dakota, USA",210000-gallon-oil-spill-from-keystone-pipeline-in-south-dakota,
"Nuclear power plant in Le Carnet, France ",blayais-nuclear-central,
"Environmental threats (industrial salmon, new mining concessions) in Chiloé, Chile",chiloe-wind-power-project-in-mapuche-territory,
"Kunlong (or Upper Thanlwin) dam on the Salween River, Myanmar",mong-ton-or-tasang-dam,
"Ywathit dam on the Salween River, Karenni state, Myanmar",mong-ton-or-tasang-dam,
"Weigyi dam on the Salween River, Karen and Karenni state, Myanmar",mong-ton-or-tasang-dam,
"Bhushan Power and Steel Limited, Jharkhand, India",subernarekha-multipurpose-project-kharkai-barrage-gamharia-in-seraikela-kharsawan-india,
"Surf Park Saint Père en Retz, France",tablistas-contra-la-destruccion-de-playas-en-lima,
"Vernamfield Aerotropolis, Jamaica",coal-fired-plant-to-be-built-by-chinese-company-jiuquan-iron-steel-at-nain-st-elizabeth-jamaica,
"Nickel rush threatens the health and environment of Obi Island's people, Indonesia",karonsie-dongi-people-and-vale-mine-in-sorowako-sulawesi-indonesia,
"Indonesia Morowali Industrial Park (IMIP), Central Sulawesi, Indonesia",karonsie-dongi-people-and-vale-mine-in-sorowako-sulawesi-indonesia,
"Delong Nickel Industrial Area, Sulawesi,  Indonesia",karonsie-dongi-people-and-vale-mine-in-sorowako-sulawesi-indonesia,
"Complejo Petroquímico El Tablazo y las luchas de El Hornito contra PDVSA, Venezuela",la-huella-de-chevron-en-venezuela,
"Contaminación en el Lago de Maracaibo, Venezuela",la-huella-de-chevron-en-venezuela,
"Criminal groups land grabbing farms and logging protected woodlands for avocado production in Uruapan, Michoacán, México ",bosques-agua-y-territorio-en-cheran,
"Second airport in Jeju (air force base),  south coast, South Korea",jeju-naval-base-construction-republic-of-korea,
"Enel coal power plant in La Spezia, Italy",enel-coal-power-plant-in-porto-tolle,
"Hilco distribution facility replaces coal-fired generating station, Little Village, Chicago, US",chicagos-toxic-doughnut-usa,
"Proyecto Hidroeléctrico Veracruz, Mexico",los-pescados-river-hydroelectric-veracruz,
